Title,Director,Cast,Genre,Notes,Year,Music
Rustom-E-Baghdad,B. J. Patel,"Dara Singh, Vijaya Chaudhary, Chandrashekhar, Randhawa, Sumitra Devi, Shakila Bano Bhopali",Costume Action,Music: Datta NaikLyrics: Asad Bhopali,1963,
Sehra,V. Shantaram,"Sandhya, Prashant, Lalita Pawar, Mumtaz, Manmohan Krishan, Ulhas, Babloo, M. Rajan, Baburao Pendharkar",Romantic Family Drama,Music: RamlalLyrics: Hasrat Jaipuri Bollywood films of 1965,1963,
Shehar Aur Sapna,K.A. Abbas,"Dilip Roy, Surekha Parker, Manmohan Krishan, Anwar Hussain",Social Drama,"National Film Award for Best Feature Film, 1 Filmfare Award, Best Film, Best Director, Best Story nominations. Music: Lyrics:",1963,
Shikari,Mohammed Hussain,"Ajit, Ragini, Helen, Madan Puri, Habib, K N Singh, Bir Sakuja, Randhir Kapoor, Tun Tun, Kamal Mehra, Shyam Kumar",Fantasy Action,"Music: G. S. KohliLyrics: Farooq Qaisar, Qamar Jalalabadi",1963,
Taj Mahal,M. Sadiq,"Pradeep Kumar, Bina Rai, Rehman, Veena, Jabeen Jalil, Jeevan, Helen, Murad, Minu Mumtaz",Historical romantic fiction,Music: RoshanLyrics: Sahir Ludhianvi,1963,
Tarzan Aur Jadugar,Radhakant,"Chitra, Azad, Indira Billi, Arvind Pandey, Tun Tun, Sunder, Rajrani",Fantasy Action,Music: Suresh TalwaLyrics: Zafar Rahi,1963,
Teen Ghaaranay,K. A. Abbas,,"Short, Documentary",[2],1963,
Tere Ghar Ke Samne,Vijay Anand,"Dev Anand, Nutan, Om Prakash, Harindranath Chattopadhyay, Jankidas, Parveen Choudhary, Rajendra Nath, Mumtaz Begum, Rashid Khan",Romantic comedy,Music: Sachin Dev BurmanLyrics: Hasrat Jaipuri,1963,
Ustad Alauddin Khan,Ritwik Ghatak,,Documentary,Produced by Sangeet Natak AkademiMusic advisor: Ustad Ali Akbar Khan,1963,
Ustadon Ke Ustad,Brij,"Ashok Kumar, Pradeep Kumar, Shakila, Sheikh Mukhtar, Johnny Walker, Helen, Anwar Hussain",Action Thriller,Music: RaviLyrics: Asad Bhopali,1963,
Yeh Dil Kisko Doon,K. Mishra,"Shashi Kapoor, Ragini, Jeevan, Agha, Sajjan, Kamal Mehra",Romance Drama,Music: Iqbal QureshiLyrics: Qamar Jalalabadi,1963,
Yeh Rastey Hain Pyar Ke,R. K. Nayyar,"Sunil Dutt, Leela Naidu, Ashok Kumar, Rehman, Motilal, Shashikala, Hari Shivdasani, Manmohan",Romantic Thriller,Music: RaviLyrics: Rajendra Krishan,1963,
Zarak Khan,Harbans,"P. Jairaj, Chitra, Tiwari, Kumud Tripathi, Naazi, W. M. Khan",Costume Action,"Music: S. MohinderLyrics: Anand Bakshi, Saba Rampuri",1963,
Zingaro,Chandrakant,"P. Jairaj, Jabeen Jalil, Tiwari, Bela Bose, Maruti",Fantasy Action,Music: S. N. TripathiLyrics: Prem Dhawan,1963,
Aandhi Aur Toofan,Mohammed Hussain,"Dara Singh, Mumtaz, Jeevan, Bhagwan, Maruti, Kamran",Action Adventure,Music: Robin BanerjeeLyrics: Faruk Kaiser,1964,
Aao Pyaar Karen,R. K. Nayyar,"Joy Mukherjee, Saira Banu, Rajendra Nath, Madhvi, Jayant, Shyam Chatterjee",Romance Drama,Music: Usha KhannaLyrics:Rajendra Krishan,1964,
Aap Ki Parchhaiyan,Mohan Kumar,"Dharmendra, Supriya Chowdhury, Shashikala, Om Prakash, Leela Chitnis, Vijayalaxmi, Manorama",Romance Drama,Music: Madan MohanLyrics: Raja Mehdi Ali Khan,1964,
Aaya Toofan,"Kedar Kapoor, Mohammed Hussain","Dara Singh, Nishi, Helen, Anwar Hussain, Randhawa, Indira Billi, Maruti, Tun Tun",Action,Music: Laxmikant PyarelalLyrics: Asad Bhopali,1964,
Apne Huye Paraye,Ajit Chakraborty,"Mala Sinha, Manoj Kumar, Shashikala, Lalita Pawar, Dulari, Agha, Iftekhar, Sunder",Romantic love triangle,"Music: Shankar JaikishanLyrics: Hasrat Jaipuri, Shailendra",1964,
April Fool,Subodh Mukherjee,"Biswajeet, Saira Banu, Nazima, I. S. Johar, Jayant, Sajjan, Chand Usmani, Ram Avtar, Shetty",Romance Musical,"Music: Shankar JaikishanLyrics: Hasrat Jaipuri, Shailendra",1964,
Arab Ka Lal,A. Shamsheer,"Samar Roy, Indra Billi, Sherry, Leela, Dilawar, Shyam Kumar",Costume Action,Music: S. KishanLyrics: A. Shamsheer,1964,
Awara Badal,Kedar Kapoor,"Ajit, Ragini, Helen, Indira Billi, Leela Mishra Jagdish Sethi, Dhumal",Action,"Music: Usha KhannaLyrics: Javed Anwar, Anand Bakshi, Jan Nisar Akhtar",1964,
Ayee Milan Ki Bela,Mohan Kumar,"Rajendra Kumar, Saira Banu, Dharmendra, Shashikala, Madan Puri, Nazir Hussain, Sulochana, Sunder, Mumtaz Begum",Romantic Drama,"Music: Shankar JaikishanLyrics: Hasrat Jaipuri, Shailendra",1964,
Badshah,Chandrakant,"Dara Singh, Nishi, Tiwari, Rani, Shakila Bano Bhopali, Maruti, Rajan Haksar",Costume Action,Music: Datta NaikLyrics: Anand Bakshi,1964,
Baghi,Ram Dayal,"Pradeep Kumar, Leela Naidu, Mumtaz, Jeevan, Veena, Helen, Vijaya Chaudhary, Jagdeep",Costume Action,Music: ChitraguptaLyrics: Hasrat Jaipuri,1964,
Baghi Shahzada,Maruti Rao,"Kishore Kumar, Kumkum, Madhumati, Maruti, B. M. Vyas, Anwar Hussain, W. M. Khan",Action,Music: Bipin Babul Lyrics: Noor Devasi & Raja Mehdi Ali Khan,1964,
Benazir,Bimal Roy,"Ashok Kumar, Meena Kumari, Shashi Kapoor, Tanuja, Durga Khote, Nirupa Roy, Tarun Bose, Asit Sen",Social Muslim Drama,Music: S. D. BurmanLyrics: Shakeel Badayuni,1964,
Beti Bete,T L V Prasad,"Sunil Dutt, Saroja Devi, Jamuna, Mehmood, Shobha Khote, Jayant, Agha",Family Drama,"Music: Shankar JaikishanLyrics: Hasrat Jaipuri, Shailendra",1964,
Bhakta Dhruvakumar,Dhirubhai Desai,"Shahu Modak, Nirupa Roy, Babloo, Indira Billi, Sunder, Niranjan Sharma",Devotional,"Music: Avinash VyasLyrics: Madan Bharti, Avinash Vyas",1964,
Birju Ustad,Manu Desai,"Sheikh Mukhtar, Vijaya Choudhary, Chandrashekhar, Mukri, Tun Tun",Action,Music: Kalyanji AnandjiLyrics: Qamar Jalalabadi,1964,
Captain Azad,Ram Rasila,"Azad, Neelam Kumari, Aruna Irani, Heera Sawant, Maqbul, Majnu, Habib",Costume Action,Music: Piter NawabLyrics: M. M. Khan,1964,
Cha Cha Cha,Chandrashekhar,"Om Prakash]], Bela Bose, Madan Puri, Iftekhar, Tun Tun",Musical Dance Drama,"Music: Iqbal QureshiLyrics: Bharat Vyas, Maqdoom Mohiuddin, Neeraj",1964,
Challenge,B. J. Patel,"Ranjan, Chitra, Bela Bose, Tiwari, Polson, Maruti, Indira Bansal",Action,Music: Ajit MerchantLyrics: Prem Dhawa,1964,
Chandi Ki Deewar,Dilip Bose,"Bharat Bhushan, Nutan, Indrani Mukherjee, Asit Sen, Sudhir, Naaz, Honey Irani, Pratima Devi",Romantic drama,Music: N. DuttaLyrics: Sahir Ludhianvi,1964,
Char Dervesh,Homi Wadia,"Feroz Khan, Sayeeda Khan, Naaz, B. M. Vyas, Mukri, Sunder",Fantasy,"Music: G. S. KohliLyrics: Anjaan, Saba Fazli, Raja Mehdi Ali Kha",1964,
Chitralekha,Kidar Sharma,"Ashok Kumar, Meena Kumari, Pradeep Kumar, Mehmood, Zeb Rehman, Achla Sachdev, Minu Mumtaz, Bela Bose",Historical romantic drama,Music: RoshanLyrics: Sahir Ludhianvi,1964,
Daal Me Kaala,Satyen Bose,"Kishore Kumar, Nimmi, Agha, Om Prakash, Bipin Gupta, Abhi Bhattacharya, Sajjan, Shammi",Comedy,"Music: C. RamchandraLyrics: Majrooh Sultanpuri, Raja Mehdi Ali Khan, Bharat Vyas, Pyarelal Santoshi",1964,
Dara Singh,Kedar Kapoor,"Dara Singh, Nishi, Jeevan, Salim Khan, Tabassum, Tiwari, Mohan Choti",Action,Music: Hansraj BehlLyrics: Prem Dhawan,1964,
Dooj Ka Chaand,Nitin Bose,"Ashok Kumar, Bharat Bhushan, B. Saroja Devi, Raaj Kumar, Azra, Chandrashekhar, Ulhas, Agha",Drama,Music: RoshanLyrics: Sahir Ludhianvi,1964,
Door Gagan Ki Chhaon Mein,Kishore Kumar,"Kishore Kumar, Supriya Chowdhury, Amit Kumar, Shashikala, Iftekhar, Sajjan, Raj Mehra, Nana Palsikar, Leela Mishra",Drama,"Music: Kishore KumarLyrics: Kishore Kumar, Shailendra",1964,
Door Ki Awaaz,Devendra Goel,"Joy Mukherjee, Saira Banu, Johnny Walker, Pran, Durga Khote, Om Prakash, Mallika",Romantic drama,Music: RaviLyrics: Shakeel Badayuni,1964,
Dosti,Satyen Bose,"Sudhir Kumar, Sushil Kumar, Sanjay Khan, Farida, Leela Mishra, Nana Palsikar, Leela Chitnis, Abhi Bhattacharya",Social Drama,Entered into the 4th Moscow International Film Festival. Music: Laxmikant PyarelalLyrics: Majrooh Sultanpuri,1964,
Dulha Dulhan,Ravindra Dave,"Raj Kapoor, Sadhana, K. N. Singh, Agha, Madhumati, Raj Mehra",Romantic drama,"Music: Kalyanji AnandjiLyrics: Anand Bakshi, Indeevar Gulshan Bawra, Haroon",1964,
Ek Din Ka Badshah,Jugal Kishore,"P. Jairaj, Nishi, Jugal Kishore, Sunder, Mohan Choti",Costume Action,"Music: Hansraj BehlLyrics: Gulshan Bawra, Prem Warbartani",1964,
Fariyad,Kidar Sharma,"Ashok Sharma, Zeb Rehman, Nazima, Achla Sachdev, Tun Tun, Bela Bose, Gopal Saigal",Social Family Drama,Music: Snehal BhatkarLyrics: Kidar Sharma,1964,
Ganga Ki Lahren,Devi Sharma,"Kishore Kumar, Dharmendra, Kumkum, Savitri, Nazir Hussain, Azra",Drama,Music: ChitraguptaLyrics: Majrooh Sultanpuri,1964,
Geet Gaya Pattharon Ne,V. Shantaram,"Jeetendra, Rajshree, Nana Palsikar, Surendra, Babloo",Romantic Drama,"Music: Ramlal Hira-PannaLyrics: Hasrat Jaipuri, Vishwamitra Adil",1964,
Gazal,Ved Madan,"Sunil Dutt, Meena Kumari, Rehman, Mehmood, Nazima, Prithviraj Kapoor, Rajendra Nath, Raj Mehra",Romantic Muslim social,Music: Madan MohanLyrics: Sahir Ludhianvi,1964,
Hamara Ghar,K. A. Abbas,"Dilip Raj, Surekha, Sonal Mehta, Rekha Rao, Nana Palsikar, Yasmeen Khan",Children Adventure,"Music: J. P. KaushikLyrics: Ali Sardar Jafri, Muhammad Iqbal",1964,
Hamara Rashtragan a.k.a. Our National Anthem,Pramod Pati,,Documentary,,1964,
Hameer Hath,Jaswant Jhaveri,"Nirupa Roy, P. Jairaj, Anita Guha, Manhar Desai, Vijay Choudhary, Sapru, B. M. Vyas",Legend Action,"Music: Sanmukh Babu UpadhyayLyrics: Neelkanth Tiwari, Uday Khanna, Saraswati Kumar Deepak",1964,
Haqeeqat,Chetan Anand,"Balraj Sahni, Dharmendra",War,Music: Madan MohanLyrics: Kaifi Azmi,1964,
Hercules,Shriram,"Dara Singh, Nishi, Mumtaz, Helen, Maruti, B. M. Vyas, Indira",Action,Music: N DuttaLyrics: Anand Bakshi,1964,
Ishaara,K. Amarnath,"Joy Mukherjee, Vyjayanthimala, Pran, Subiraj, Azra, Jayant",Melodrama,Music: Kalyanji AnandjiLyrics: Majrooh Sultanpuri,1964,
Jahan Ara,Vinod Kumar,"Bharat Bhushan, Mala Sinha, Shashikala, Prithviraj Kapoor, Sunder, Minu Mumtaz, Chandrashekhar, Achla Sachdev, Om Prakash",Historical romantic-fiction drama,Music: Madan MohanLyrics: Rajendra Krishan,1964,
Jantar Mantar,Radhakant,"Mahipal, Vijaya Choudhury, Ulhas",Fantasy,Music: Sardar MalikLyrics: Hasrat Jaipuri,1964,
Ji Chahta Hai,Bibhuti Mitra,"Joy Mukherjee, Rajshree, Motilal, Shyama, Rajendra Nath, Jeevan, Achla Sachdev",Romantic drama,Music: Kalyanji AnandjiLyrics: Hasrat Jaipuri,1964,
Kaise Kahoon,Atma Ram,"Biswajeet, Nanda, Rehman, Naaz, Om Prakash, Manmohan, Asit Sen, Durga Khote",Melodrama,Music: S. D. BurmanLyrics: Shakeel Badayuni,1964,
Kashmir Ki Kali,Shakti Samanta,"Shammi Kapoor, Sharmila Tagore, Pran, Anoop Kumar, Nazir Hussain, Madan Puri, Sunder, Tun Tun, Dhumal",Romantic Musical,Music: O. P. NayyarLyrics: S. H. Bihari,1964,
Khufia Mahal,Akkoo,"P. Jairaj, Chitra, Tun Tun, Sherry, Sheikh, Paul Sharma",Fantasy Horror,"Music: PardesiLyrics: Zafar Rahi, Shyam Hindi",1964,
Kohra,Biren Nag,"Waheeda Rehman, Biswajeet, Lalita Pawar, Madan Puri, Manmohan Krishna, Abhi Bhattacharya","Thriller, Mystery",Music: Hemant KumarLyrics: Kaifi Azmi,1964,
Leader,,"Dilip Kumar, Vyjantimala",,,1964,
Magic Carpet,,,,,1964,
Mahasati Anusuya,,,,,1964,
Mahasati Behula,,,,,1964,
Maikhana,,,,,1964,
Main Bhi Ladki Hoon,,,,,1964,
Main Suhagan Hoon,,Mala Sinha,,,1964,
Majboor,,"Waheeda Rehman, Biswajeet, Naaz",,,1964,
Mera Qasoor Kya Hai,,Nanda,,,1964,
Mr. X in Bombay,,"Kishore Kumar, Kumkum",,,1964,
Phoolon Ki Sej,,"Ashok Kumar, Vyjanthimala, Manoj Kumar",,,1964,
Picnic,,,,,1964,
Pooja Ke Phool	A. Bhimsingh,,"Mala Sinha, Pran",,,1964,
Punar Milan,Ravindra Dave,"Ameeta, Mumtaz Begum, Leela Chitnis",,,1964,
Qawwali Ki Raat,,,,,1964,
Rahul,,,,,1964,
Rajkumar,K. Shankar,"Shammi Kapoor, Sadhana, Rajendranath, Pran",Musical/Action,,1964,
Roop Sundari,,,,,1964,
Rustom-E-Rome,,,,,1964,
Samson,Nanabhai Bhatt,"Dara Singh, Ameeta, Feroz Khan, B. M. Vyas, Mumtaz, Mohan Choti",,,1964,
Sangam,Raj Kapoor,"Raj Kapoor, Vyjayanthimala, Rajendra Kumar",Social,,1964,
Sanjh Aur Savera,Hrishikesh Mukherjee,,,,1964,
Sant Gyaneshwar,,,,,1964,
Sarfarosh,,,,,1964,
Sati Savitri,Shantilal Soni,"Mahipal, Jeevan",Religious,,1964,
Shabnam,Aspi Irani,"Mehmood, Helen",,,1964,
Shagoon,Nazir,Waheeda Rehman,,,1964,
Sharabi,Rajrishi,"Dev Anand, Madhubala, Radhakrishan, Badri Prasad, Daisy Irani, Lalita Pawar, Sulochana, Ram Mohan, Ravikant, Pardesi",Social Romance,Music: Madan Mohan Lyrics: Rajendra Krishan,1964,
Shehnai,S. D. Narang,"Biswajeet, Rajshree, Johnny Walker, Chand Usmani, Nirupa Roy, Praveen Choudhary, Iftekhar, Sapru, Honey Irani, Laxmi Chhaya, Asit Sen",Social Family Drama,Music: Ravi Lyrics:Rajendra Krishan,1964,
Subhadra Haran,Datta Dharamadhikari,"Shahu Modak, Jayshree Gadkar, Chitra, Suryakant, Arun Sarnaik",Mythology,Music: Prabhakar JogLyrics: Saraswati Kumar Deepak.[2],1964,
Tarzan Aur Jalpari,,,,,1964,
Tere Dwaar Khada Bhagwan,Ravindra Dave,"Ruby Mayer, Shahu Modak, Durga Khote",,,1964,
Veer Bhimsen,Chandrakanth,"Dara Singh, Mumtaz",Epic,,1964,
Woh Kaun Thi?,Raj Khosla,"Manoj Kumar, Sadhana, Prem Chopra,",Horror,,1964,
Yaadein,,Sunil Dutt,,,1964,
Ziddi,,"Joy Mukherjee, Asha Parekh",,,1964,
Zindagi,,"Rajendra Kumar, Vyjantimala",,,1964,
Aadhi Raat Ke Baad,Nanabhai Bhatt,"Sajjan, Ulhas, Ragini, Murad, Ashok Kumar, Sailesh Kumar",,,1965,
Aasmaan Mahal,K. A. Abbas,"Prithviraj Kapoor, Dilip Kumar, Nana Palsikar",,,1965,
Akashdeep,Phani Majumdar,"Dharmendra, Ashok Kumar, Nanda, Mehmood",,,1965,
Arzoo,Ramanand Sagar,"Rajendra Kumar, Sadhana, Nazima, Feroz Khan",,,1965,
Bedaag,R. Bhattacharya,"Manoj Kumar, Nanda",,,1965,
Bekhabar,Nanabhai Bhatt,,,,1965,
Bharat Katha,,,,,1965,
Bharat Milaap,Babubhai Mistri,,,,1965,
Bheegi Raat,Kalidas,"Meena Kumari, Ashok Kumar, Pradeep Kumar, Shashikala",,,1965,
Bhoot Bungla,Mehmood,"Mehmood, Tanuja",,,1965,
Birthday,,,,,1965,
Bombay Race Course,Kedar Kapoor,,,,1965,
Boxer,Radhakant,"Dara Singh, Mumtaz",,,1965,
Chand Aur Suraj,Dulal Guha,"Ashok Kumar, Dharmendra, Tanuja, Nirupa Roy",,,1965,
Chhoti Chhoti Baatein,Motilal,"Motilal, Nadira, Leela Mishra",,,1965,
Do Dil,Hrishikesh Mukherji,"Pran, Biswajit, Rajshree",,,1965,
Ek Saal Pehle,Dharam Kumar,"Sujit Kumar, Sayeeda Khan, Helen, Sunder",,,1965,
Ek Sapera Ek Lutera,Naresh Kumar,Feroz Khan,,,1965,
Faisla,Jugal Kishore,"Sheikh Mukhtar, Helen, Jeevan",,,1965,
Faraar,Pinaki Mukherji,,,,1965,
Fear,,,,,1965,
A Great Day,,,,,1965,
Guide,Vijay Anand,"Dev Anand, Waheeda Rehman","Drama, Romance, Musical, Social",,1965,
Gumnaam,Raja Nawathe,"Pran, Helen, Manoj Kumar, Nanda, Mehmood",Thriller/Musical,,1965,
Himalaya Ki God Mein,Vijay Bhatt,"Manoj Kumar, Mala Sinha",,,1965,
Hum Diwane,Bhagwan,"Bhagwan, Helen, Mumtaz, Chandrashekhar",,,1965,
Hum Sab Ustad Hain,Maruti,"Kishore Kumar, Ameeta, Sheikh Mukhtar",,,1965,
Janwar,Bhappi Sonie,"Shammi Kapoor, Rajshree, Rajendra Nath",Musical,,1965,
Jab Jab Phool Khile,Suraj Prakash,"Nanda, Shashi Kapoor, Agha",Musical,,1965,
Jadui Angoothi,,,,,1965,
Jahan Sati Wahan Bhagwan,Satish Kumar,,,,1965,
Janam Janam Ke Saathi,Nand Kishore,"Premnath, Kamini Kaushal, Lalita Pawar",,,1965,
Johar-Mehmood in Goa,,"I. S. Johar, Mehmood, Simi Garewal, Sonia Sahni",Comedy,,1965,
Kaajal,Ram Maheshwari,"Dharmendra, Meena Kumari, Padmini, Raaj Kumar",Social,,1965,
Khakaan,Aspi Irani,"Dara Singh, Mumtaz, Ratnamala, Prithviraj Kapoor",,,1965,
Khandan,Bhim Singh,"Sunil Dutt, Nutan, Pran, Sudesh Kumar",,,1965,
Lutera,Harbans Singh,"Dara Singh, Nishi, Prithviraj Kapoor",,,1965,
Mahabharat,Babubhai Mistri,"Pradeep Kumar, Dara Singh, Padmini","History, Religious",,1965,
Main Hoon Aladdin,Mohammed Husaain,"Ajit, Sayeeda Khan, Madan Puri",,,1965,
Main Hoon Jadugar,Jugal Kishore,"Jairaj, Tuntun, Tiwari",,,1965,
Mere Sanam,Amar Kumar,"Asha Parekh, Biswajit, Pran",,,1965,
Mohabbat Isko Kehte Hain,Akhtar Mirza,"Shashi Kapoor, Nanda",,,1965,
Nai Umar Ki Nai Fasal,R. Chandra,"Tanuja, Rajeev",,,1965,
Namaste Ji,Daljit Krishan,"Mehmood, Ameeta, I. S. Johar, Manorama",,,1965,
Naya Kanoon,R.C. Talwar,"Bharat Bhushan, Vyjayanthimala, Ashok Kumar",,,1965,
Neela Aakash,Rajendra Bhatia,"Dharmendra, Mala Sinha",,,1965,
Nishan,Aspi Irani,"Sanjeev Kumar, Nazima, Sheikh Mukhtar, Shammi",,,1965,
Noor Mahal,Noshir Engineer,"Jagdeep, Madhumati, Lalita Desai",,,1965,
Oonche Log,Phani Majumdar,"Ashok Kumar, Feroz Khan",,,1965,
Poonam Ki Raat,Kishore Sahu,"Manoj Kumar, Kumud Chugani",,,1965,
Purnima,Narendra Suri,"Dharmendra, Meena Kumari",,,1965,
Raaka,Kedar Kapoor,"Dara Singh, Mumtaz, K.N. Singh",,,1965,
Rendezvous,,,,,1965,
Rishte Naate,K. S. Gopal Krishnan,"Raaj Kumar, Nutan, Kanhaiyalal",,,1965,
Rustom-E-Hind,Kedar Kapoor,"Dara Singh, Mumtaz, Laxmi Chhaya",,,1965,
Saat Samundar Paar,Mohammed Husaain,"Dara Singh, Ameeta, Ulhas",,,1965,
Saheli,Arjun Hingorani,"Pradeep Kumar, Vijaya Chowdhary, Tun Tun",,,1965,
Sangram,Babubhai Mistri,"Dara Singh, Aruna Irani, Randhawa",,,1965,
Sati Nari,Pankaj,"Anita Guha, Sunder, Jeevan",,,1965,
Shaheed,S. Ram Sharma,"Manoj Kumar, Nirupa Roy, Pran, Prem Chopra, Kamini Kaushal",Revolutionary Patriotic,,1965,
Shakespeare Wallah,,,,,1965,
Shankar Seeta Anusuya,Manibhai Vyas,,,,1965,
Sher Dil,Chand,"Dara Singh, Parveen Chaudhary, Bhagwan",,,1965,
Shree Ram Bharat Milap,Manibhai Vyas,"Prithviraj Kapoor, Vanmala, Raaj Kumar, Nirupa Roy",,,1965,
Shreeman Funtoosh,Shantilal Soni,"Kumkum, Kishore Kumar",,,1965,
Sikandar E Azam,Kedar Kapoor,"Dara Singh, Mumtaz, Prithviraj Kapoor, Premnath",,,1965,
Sindbad Alibaba and Aladdin,P.N. Arora,"Pradeep Kumar, Sayeeda Khan, Helen, Bhagwan",,,1965,
Tarzan and King Kong,A. Shamsheer,"Dara Singh, Mumtaz, Bhagwan",,,1965,
Teen Devian,,"Dev Anand, Nanda, Kalpana, Simi Garewal",Musical,,1965,
Teen Sardar,Radhakant,"Randhawa, Parveen Chaudhary",,,1965,
Teesra Kaun,Mohammed Hussain,"Feroz Khan, Shahsikala, Kalpana, Rajan Haksar, Pran",,,1965,
Waqt,Yash Chopra,"Sunil Dutt, Sadhana, Raaj Kumar, Shashi Kapoor, Sharmila Tagore, Balraj Sahni, Achla Sachdev",,,1965,
Zindagi Aur Maut,N.A.Ansari,"Pradeep Kumar, Bela Bose, Faryal",,,1965,
Akalmand,,"Dev Anand, I. S. Johar, Kishore Kumar, Sonia Sahni",,,1966,
Aaye Din Bahar Ke,J Om Prakash,"Dharmendra, Asha Parekh, Nazima",,,1966,
Afsana,B R Chopra,"Ashok Kumar, Padmini, Pradeep Kumar",crime drama,,1966,
Amrapali,Lekh Tandon,"Sunil Dutt, Vyjayanthimala",Biopic,Indian submission for the Academy Award for Best Foreign Language Film,1966,
Anupama,Hrishikesh Mukherjee,"Dharmendra, Sharmila Tagore, Shashikala, Deven Verma",,,1966,
Badal,,Sanjeev Kumar,,,1966,
Bahadur Daku,,,,,1966,
Baharen Phir Bhi Aayengi,Shaheed Latif,"Dharmendra, Mala Sinha, Tanuja, Rehman",,,1966,
Bandar Mera Sathi,,,,,1966,
Biradari,Ram Kamlani,"Shashi Kapoor, Faryal, Pran, Lalita Pawar",,,1966,
Biwi Aur Makaan,,"Biswajeet, Kalpana, Mehmood, Shabnam",,,1966,
Budtameez,Manmohan Desai,"Shammi Kapoor, Sadhana",,,1966,
Chale Hain Sasural,,,,,1966,
Chhota Bhai,,"Nutan, Rehman",,,1966,
Daadi Maa,L V Prasad,"Ashok Kumar, Bina Rai",,,1966,
Daku Mangal Singh,,,,,1966,
Devar,Mohan Sehgal,"Dharmendra, Sharmila Tagore, Deven Verma, Shashikala",,,1966,
Dus Lakh,,"Sanjay, Babita, Om Prakash",,,1966,
Do Badan,,"Manoj Kumar, Asha Parekh, Pran",,,1966,
Do Dilon Ki Dastaan,,,,,1966,
Gaban,Hrishikesh Mukherjee,"Sunil Dutt, Sadhana",Social,Based on Munshi Premchand's novel Gaban,1966,
Hum Kahan Ja Rahe Hain,,,,,1966,
Husn Aur Ishq,Naresh Kumar,"Sanjeev Kumar, L. Vijayalakshmi, Indira Billi, Indira Bansal",,alias Alif Laila,1966,
Husn Ka Ghulam,,,,,1966,
Insaaf,,"Dara Singh, Prithviraj Kapoor, Azad, Praveen Chowdhury, Helen, Lalita Pawar, Tun Tun, Kammo, Johnny Whisky, Tiger Joginder Singh",,,1966,
Jawan Mard,,,,,1966,
Johar in Kashmir,I. S. Johar,"Mumtaz Begum, Rajan Haksar, I. S. Johar",,,1966,
Laadla,,,,,1966,
Labela,,,,,1966,
Ladka Ladki,Som Kaskar,"Kishore Kumar, Mumtaz, Bhagwan",,,1966,
Ladki Sahyadri Ki,V. Shantaram,"Sandhya, Shalini Abhyankar, Vatsala Deshmukh, Kumar Dighe, Keshavrao Date, Baburao Pendharkar, Ganesh Solanki",Social Drama,"Music: Vasant Desai, Lyrics: Bharat Vyas",1966,
Love in Tokyo,,"Joy Mukerjee, Asha Parekh, Pran",,,1966,
Love and Murder,,,,,1966,
Mera Saaya,,"Sunil Dutt, Sadhana, Prem Chopra",,,1966,
Mohabbat Zindagi Hai,,"Dharmendra, Rajshree, Mehmood Ali",,,1966,
Neend Hamari Khwab Tumhare,,"Shashi kapoor,nanda,balraj sahni,shashi kala,nirupa roy,omprakash,manorama,",,,1966,
Phool Aur Paththar,,,,,1966,
Pyaar Kiye Jaa,,,,,1966,
Sagaai,,"Biswajeet Chatterjee, Rajshree Shantaram",,,1966,
Sannata,,,,,1966,
Sau Saal Baad,,,,,1966,
Sawan Ki Ghata,,"Manoj Kumar, Sharmila Tagore, Pran",,,1966,
Shankar Khan,,,,,1966,
Shera Daku,,,,,1966,
Smuggler,,,,,1966,
Sunhera Jaal,,,,,1966,
Suraj,T. Prakash Rao,"Rajendra Kumar, Vyjayanthimala, Ajit Khan, Mumtaz",,,1966,
Tarzan Aur Jadui Chirag,,,,,1966,
Tasveer,,"Feroz Khan, Kalpana",,,1966,
Teesri Kasam,,"Raj Kapoor, Waheeda Rehman",,,1966,
Teesri Manzil,Vijay Anand,"Shammi Kapoor, Asha Parekh, Prem Nath, Randhir, Helen",,,1966,
Thakur Jarnail Singh,,,,,1966,
Toofan Mein Pyaar Kahan,Phani Majumdar,Ashok Kumar,,,1966,
Uski Kahani,,,,,1966,
Yatrik,,,,,1966,
Yeh Raat Phir Na Aayegi,,"Sharmila Tagore, Biswajeet, Mumtaz, Shailash Kumar",,,1966,
Yeh Zindagi Kitni Haseen Hai,"Joy Mukherjee, Ashok Kumar, Saira Banu",,,,1966,
Zimbo Ka Beta,,,,,1966,
6.40 PM,,,,,1967,
Aag,,"Feroz khan, Mumtaz",love story,Music: Usha khanna,1967,
Aamne Samne,Suraj Prakesh,"Shashi Kapoor, Sharmila Tagore, Prem Chopra",Musical,,1967,
Aman,,"Rajendra Kumar, Saira banu",war/Social,Music: Shankar Jaikishan,1967,
An Evening in Paris,,"Shammi Kapoor, Sharmila Tagore, Pran",,Music: Shankar Jaikishan,1967,
Anita,,"Manoj Kumar, Sadhana, I.S. Johar",Suspense,Music: Laxmikant Pyarelel,1967,
Around the World,,"Raj Kapoor, Rajshree, Pran",Love story,Music: Shankar Jaikishan,1967,
Aurat,,"Pran, Padmini, Feroz Khan, Rajesh Khanna",,Music: Ravi,1967,
Badrinath Yatra,,,,,1967,
Baghdad Ki Raatein,,,,,1967,
Baharon Ke Sapne,"Nasir Hussain, Asha Parekh, Rajesh Khanna",,,Music: R.D. Burman,1967,
Bahu Begum,M. Sadiq,"Pradeep Kumar, Meena Kumari, Ashok Kumar",Drama,Music: Roshan,1967,
Bhakta Prahlada,,,,,1967,
Boond Jo Ban Gayee Moti,V. Shantaram,"Jeetendra, Mumtaz, Nana Palsikar, Lalita Pawar, Akash Deep, Vaishali",Social Crime Drama,Music: Satish BhatiaLyrics: Bharat Vyas,1967,
C.I.D. 909,,"Mumtaz, Feroz Khan",action,O.P. Nayyar,1967,
Chand Par Chadayee,,,,,1967,
Chandan Ka Palna,,"Dharmendra, Meena Kumari",,,1967,
Chhaila Babu,,,,,1967,
Chhoti Si Mulaqat,,"Vyjayanthimala, Uttam Kumar",,,1967,
Dharti Ki Pukar,,,,,1967,
Dil Ne Pukara,,,,,1967,
Dilruba,,,,,1967,
Diwana,,"Raj Kapoor, Saira Banu",,,1967,
Do Dushman,,,,,1967,
Dulhan Ek Raat Ki,,"Dharmendra, Nutan, Rehman",,,1967,
Duniya Nachegi,,,,,1967,
Farz,Ravikant Nagaich,"Jeetendra, Babita",,,1967,
Gautama the Buddha,,,,,1967,
Ghar Ka Chiraag,,Dharmendra,,,1967,
Gunahon Ka Devta,,"Rajshree Shantaram, Jeetendra, Leela Chitnis",,,1967,
Gunehgar,,,,,1967,
Hamare Gam Se Mat Khelo,,,,,1967,
Hamraaz,B.R. Chopra,"Sunil Dutt, Raaj Kumar, Vimi",Musical/Suspense,,1967,
Hare Kanch Ki Chooriyan,,,,,1967,
Hatey Bazarey,,,,,1967,
Hum Do Daku,,,,,1967,
Jaal,,"Mala Sinha, Biswajeet",,,1967,
Jab Yaad Kisi Ki Aati Hai,,"Dharmendra, Mala Sinha",,,1967,
Jewel Thief,Vijay Anand,"Dev Anand, Vijayanthimala",,,1967,
Johar in Bombay,,,,,1967,
Lamboo in Hong Kong,,,,,1967,
Latt Saheb,,"Shammi Kapoor, Nutan",,,1967,
Lav-Kush,,,,,1967,
Majhli Didi,,"Dharmendra, Meena Kumari",,,1967,
Maya Sundari,,,,,1967,
Meherbaan,,"Nutan, Sunil Dutt, Ashok Kumar",,,1967,
Mera Bhai Mera Dushman,,,,,1967,
Mera Munna,,,,,1967,
Milan,,"Sunil Dutt, Nutan, Om Prakash, Pran",,,1967,
Milan Ki Raat,,,,,1967,
Nai Roshni,,"Mala Sinha, Biswajeet, Ashok Kumar, Tanuja",,,1967,
Naunihaal,,,,,1967,
Nawab Siraz-ud-Daula,,,,,1967,
Naya Raasta,,,,,1967,
Night in London,,"Mala Sinha, Biswajeet",,,1967,
Noor Jehan,,Meena Kumari,,,1967,
Palki,,"Waheeda Rehman, Rajendra Kumar",,,1967,
Patthar Ke Sanam,,"Manoj Kumar, Waheeda Rehman, Mumtaz, Pran",,,1967,
Raat Aur Din,,"Nargis Dutt, Pradeep Kumar",,,1967,
Raaz,,"Rajesh Khanna, Babita",,,1967,
Ram Aur Shyam,,"Dilip Kumar, Waheeda Rehman, Mumtaz, Pran",,,1967,
Ram Rajya,Vijay Bhatt,"Bina Rai, Kumar Sen, Badri Prasad, Kanhaiyalal, Farida Jalal, Anil Kumar, Jay Vijay",Religious,Music: Vasant DesaiLyrics: Bharat Vyas,1967,
Sardar,,,,,1967,
Shagird,,"Joy Mukherjee, Saira Bano",,,1967,
Shamsher,,,,,1967,
Taqdeer,,,,,1967,
Upkar,Manoj Kumar,"Manoj Kumar, Asha Parekh, Prem Chopra, Pran, Madan Puri, Kanhaiya Lal",Social,,1967,
Wahan Ke Log,,,,,1967,
Woh Koi Aur Hoga,,,,,1967,
Aabroo,C L Rawal,"Deepak Kumar, Ashok Kumar, Vimi Tun Tun, Rehman, Jeevan, Mukri, Lalita Pawar, Nirupa Roy, Sunder",Romantic melodrama,,1968,Music: Sonik OmiLyrics: G. L. Rawal
Aadmi,A. Bhim Singh,"Dilip Kumar, Manoj Kumar, Waheeda Rehman, Pran, Simi Garewal, Agha, Ulhas, Mohan Choti, Sulochana",Drama,,1968,Music: NaushadLyrics: Shakeel Badayuni
Aanchal Ke Phool,Karunesh Thakur,"Kamini Kaushal, Jayant, Chand Usmani, Madan Puri, Jeevan, Sunder, Ulhas",Social Family Drama,,1968,Music: Ved SethiLyrics: Naqsh Lyallpuri
Aashirwad,Hrishikesh Mukherjee,"Ashok Kumar, Sanjeev Kumar, Sumita Sanyal, Sajjan, Veena, Harindranath Chattopadhyay, Sarika, Bipin Gupta, Ashim Kumar, Samar Roy, Abhi Bhattacharya",Family Melodrama,,1968,"music: Vasant DesaiLyrics: Harindranath Chattopadhyay, Gulzar"
Aankhen,Ramanand Sagar,"Dharmendra, Mala Sinha, Mehmood, Kumkum, Nazir Hussain, Sujit Kumar, Lalita Pawar, Daisy Irani",Thriller,,1968,Music: RaviLyrics: Sahir Ludhianvi
Abhilasha,Amit Bose,"Meena Kumari, Sanjay Khan, Nanda, Rehman, Murad, Agha, Mohan Choti, Sulochana",Family Drama,,1968,Music: R D BurmanLyrics: Majrooh Sultanpuri
Anjam,Shiv Kumar,"Feroz Khan, Shahida, Helen, N. A. Ansari, Sunder, Azad, Johnny Whisky, Jeevankala",Action Thriller,,1968,"Music: GaneshLyrics: Qamar Jalalabadi, Zafar Rahi, Akhtar Romani"
Anokhi Raat,Asit Sen,"Sanjeev Kumar, Zaheeda, Ajay (Parikshit Sahni), Aruna Irani, Tarun Bose, Keshto Mukherjee, Mukri, Badri Prasad, Anwar",Drama,,1968,Music: RoshanLyrics: Indeevar
Apna Ghar Apni Kahani,Phani Majumdar,"Shekhar, Bina Rai, Mumtaz, David, Sudhir, Bela Bose, Keshto Mukherjee, Madhumati",Social Family Drama,,1968,Music: N. DuttaLyrics: Qamar Jalalabadi
Aulad,Kundan Kumar,"Jeetendra, Babita, Mehmood, Achala Sachdev, Aruna Irani, Helen, Jeevan, Nazir Hussain, Sujit Kumar, Manmohan, Sulochana Chatterjee",Family Drama,,1968,Music: ChitraguptaLyrics: Majrooh Sultanpuri
