Title,Director,Cast,Genre,Notes,Year,Music
Baazi,Moni Bhattacharya,"Dharmendra, Waheeda Rehman, Mehmood, Nazir Hussain, Helen, Johnny Walker, Ulhas, N. a. Ansari, Manmohan, Amar",Suspense Thriller Romance,,1968,Music: Kalyanji AnandjiLyrics: Shakeel Badayuni
Baharon Ki Manzil,Y. H. Rizvi,"Dharmendra, Meena Kumari, Rehman, Farida Jalal, Tun Tun, Hashmi, Anwar Hussain, Wasti",Family Drama,,1968,Music: LaxmikantPyarelalLyrics: Majrooh Sultanpuri
Balram Shri Krishna,Chandrakant,"Dara Singh, Savitri, Shahu Modak, Premnath, Jayshree Gadkar, Gitanjali, Aruna Irani, Randhawa",Mythology,,1968,Music: C. RamchandraLyrics: Kavi Pradeep
Bambai Raat Ki Bahon Mein,K A Abbas,"Persis Khambatta, Vimal Ahuja, Jalal Agha, Madhavi, Jeevan, Surekha, David, A. K. Hangal",Social,,1968,"Music: J P KaushikLyrics: Hasan Kamaal, Jalal Agha"
Brahmachari,Bhappi Sonie,"Shammi Kapoor, Rajshree, Pran, Mumtaz, Jagdeep, Dhumal, Mohan Choti, Asit Sen, Krishan Dhawan, Manmohan, Farida Dadi, Sachin Pilgaonkar, Mehmood Jr.",Social Drama,,1968,"Music: Shankar JaikishanLyrics: Hasrat Jaipuri, Shailendra"
CID Agent 302,S. Azim,"Azad, Indira Billi, Tun Tun, Ram Mohan, Narbada Shamkar, Sherry, Birju, Shakila Bano Bhopali, Baby Raje",Spy Thriller,,1968,"Music: IqbalLyrics: Aziz Gazi, Tabish Kanpuri"
Dil Aur Mohabbat,Anand Datta,"Joy Mukherjee, Sharmila Tagore, Ashok Kumar, K. N. Singh, Johnny Walker, Nazir Hussain, Bela Bose, Gajanan Jagirdar, Jankidas, Anoop Kumar, Sachin Pilgaonkar, Purnima, Tun Tun",Thriller Suspense Romance,,1968,"Music: O P NayyarLyrics: Aziz Kashmiri, Shewan Rizvi, S. H. Bihari, Verma Malik"
Do Dooni Char,Debu Sen,"Kishore Kumar, Tanuja, Iftekhar, Asit Sen, Surekha, Rashid Khan, Neetu Singh, Lata Arora, Chandrima Bhaduri",Comedy Drama,,1968,Music: Hemant KumarLyrics: Gulzar
Do Kaliyaan,"R. Krishnan, S. Panju","Biswajeet, Mala Sinha, Mehmood, Baby Soniya (Neetu Singh), Om Prakash, Nigar Sultana, Bharathi, Shabnam, Sonia Sahni, Manorama",Comedy Family Drama,,1968,Music: RaviLyrics: Sahir Ludhianvi
Duniya,T. Prakash Rao,"Dev Anand, Vyjayanthimala, Balraj Sahni, Prem Chopra, Johnny Walker, Madan Puri, Lalita Pawar, Nana Palsikar, Laxmi Chhaya, Jagdish Raj, Sulochana",Romantic Thriller,,1968,"Music: Shankar JaikishanLyrics: Hasrat Jaipuri, S. H. Bihari and Gopaldas Neeraj"
Ek Kali Muskai,Vasant Joglekar,"Ashok Kumar, Joy Mukherjee, Meera Joglekar, Nirupa Roy, Om Prakash, Mehmood, Lalita Pawar, Bina, Nana Palsikar, Sunder, Malika",Romance Social Drama,,1968,Music: Madan MohanLyrics: Rajendra Krishan
Ek Phool Ek Bhool,Kedar Kapoor,"Dev Kumar, Zeb Rehman, Jayanti, K. N. Singh, Madan Puri, Helen, Sudhir, Sunder, Dulari, Narmada Shankar, Ram Mohan",Social,,1968,Music: Usha KhannaLyrics: Indeevar
Ek Raat,Rajnath,"Sheikh Mukhtar, Simi, Ravi Kumar, Madan Puri, Shyama, David, Samson, Laxmi Chhaya, Helen, Nazir Kashmiri",Suspense Thriller,,1968,"Music: Usha KhannaLyrics: Yogesh, Jalal Malihabadi, Anjaan"
Fareb,Jugal Kishore,"Dev Kumar, Faryal, Bela Bose, Maruti, Rajan Haksar, Kundan, Sushma, N. A. Ansari",Thriller,,1968,Music: Usha KhannaLyrics: Asad Bhopali
Farishta,Kedar Kapoor,"Dev Kumar, Nivedita, Mehmood Jr., Gajanan Jagirdar, Master Shahid, Sudhir, Tun Tun",Drama,,1968,Music: Dattaram WadkarLyrics: Asad Bhopali
Gauri,A. Bhim Singh,"Sunil Dutt, Nutan, Sanjeev Kumar, Mumtaz, Rajendra Nath, Om Prakash, Laxmi Chhaya, Urmila Bhatt, Leela Mishra, Ashim Kumar",Melodrama,,1968,Music: RaviLyrics: Rajendra Krishan
Golden Eyes Secret Agent 077,Kamal Sharma,"Sailesh Kumar, Mumtaz, Helen, Ravi Kumar, Shabnam, Asit Sen, B. M Vyas, Ulhas, Madhumati, Sheikh, Nazir Kashmiri, Abu Bakar",Spy Action Thriller,,1968,Music: Baldev NathLyrics: Shewan Rizvi
Har Har Gange,Babubhai Mistry,"Abhi Bhattacharya, Bharathi, Sulochana, Tun Tun, Mahesh Desai, B. M. Vyas, Jeevan, Helen, Madhumati, Raj Kumar, Polson, S. N. Tripathi",Religious,,1968,Music: S. N. TripathiLyrics: Kavi Pradeep
Haseena Maan Jayegi,Prakash Mehra,"Shashi Kapoor, Babita, Ameeta, Amar, Johnny Walker, Sapru, Manmohan, Niranjan Sharma",Romance,,1968,"Music: Kalyanji Anandji Lyrics: Qamar Jalalabadi, Akhtar Romani, Prakash Mehra"
Haye Mera Dil,Ved Madan,"Kishore Kumar, Kumkum, I. S. Johar, Laxmi Chhaya, Madan Puri, Prem Chopra, Raj Mehra, Parveen Paul",Comedy,,1968,"Music: Usha KhannaLyrics: Pyare Lal Santoshi, S. H. Bihari, Anand Bakshi"
Humsaya,Joy Mukherjee,"Joy Mukherjee, Sharmila Tagore, Mala Sinha, Rehman, Gajanan Jagirdar, Sapru, Malika, Polson",Romantic Spy Drama,,1968,"Music: O P NayyarLyrics: Hasrat Jaipuri, Shewan Rizvi, S. H. Bihari"
Izzat,T. Prakash Rao,"Dharmendra, Tanuja, Jayalalithaa, Mehmood, Balraj Sahni, Tiwari, Mukri, David, Devika, Lalita Pawar",Social,,1968,Music: Laxmikant PyarelalLyrics: Sahir Ludhianvi
Jawab Aayega,"Ismat Chugtai, Shahid Lateef",,Children,,1968,
Jhuk Gaya Aasman,Lekh Tandon,"Rajendra Kumar, Saira Banu, Rajendra Nath, Prem Chopra, David, Durga Khote, Gajanan Jagirdar, Kamal Kapoor, Narendranath, Hari Shivdasani, Parveen Choudhary, Ruby Myers, Ram Avatar",Romantic fantasy Drama,,1968,"Music: Shankar JaikishanLyrics: Hasrat Jaipuri, Shailendra, S. H. Bihari"
Juari,Suraj Prakash,"Shashi Kapoor, Nanda, Kalpana, Tanuja, Rehman, David, Madan Puri, Naaz, Agha, Achala Sachdev, Kamal Kapoor, Sulochana",Melodrama,,1968,Music: Kalyanji AnandjiLyrics: Anand Bakshi
Jung Aur Aman,Nanabhai Bhatt,"Dara Singh, Mumtaz, Randhawa, Krishna Kumari, Jayant, Murad, Nadira, Laxmi Chhaya, Rajan Haksar, Mohan Choti",Action,,1968,"Music: G. S. KohliLyrics: Prem Dhawan, Hasrat Jaipuri, Anjaan"
Kahin Aur Chal,Vijay Anand,"Dev Anand, Asha Parekh, Shobha Khote, Madan Puri, Sunder, Jagdish Raj",Romantic Drama,,1968,"Music: Shankar JaikishanLyrics: Hasrat Jaipuri, Shailendra"
Kahin Din Kahin Raat,Darshan,"Biswajeet, Sapna, Pran, Helen, Johnny Walker, Veena, Malika, Murad, Bipin Gupta, Mohan Choti, Nadira, Habib, Ram Avatar",Action Thriller,,1968,"Music: O P NayyarLyrics: S. H. Bihari, Aziz Kashmiri"
Kanyadaan,Mohan Sehgal,"Shashi Kapoor, Asha Parekh, Dileep Raj, Sayeeda Khan, Om Prakash, Achala Sachdev, Tun Tun, Sabita Chatterjee, Sarita Khatau, Gopal Sehgal, Laxmi Chayya, Nazir Kashmiri, Rashid Khan",Social Romantic melodrama,,1968,"Music: Shankar JaikishanLyrics: Gopaldas Neeraj, Hasrat Jaipuri"
Khiladi,Homi Wadia,"Fearless Nadia, Dilip Raj, Sabita, Uma, Suzie, W. M. Khan, Vishwas Kunte, Habib",Action,,1968,Basant Pictures. Music: Lala SattarLyrics: Faruk Kaiser
Kismat,Manmohan Desai,"Biswajeet, Babita, Helen, Murad, Ulhas, Kamal Mehra, Hiralal, Hari Shivdasani, Jagdish Raj, Tun Tun, Polson, Shetty",Romance Suspense Thriller,,1968,Music: O. P. NayyarLyrics: Noor Dewasi
Lady Killer,B. J. Patel,"Aroon Sarnaik, Shabnam, David, Helen, Satyen Kappu, Nilofar, Rani, Arvind Rathod",Action Thriller,,1968,Music: Ajit MerchantLyrics: Indeevar
Lahoo Pukarega,S. N. Tripathi,"Sujit Kumar, Shabnam, Tabassum, Madhumaliti, Salim Khan, Sunder, Rani, Habib, Noorjehan, Kundan",Action,,1968,"Music: S N TripathiLyrics: Saba Fazli, Jaffer Ali"
London Express,B. J. Patel,"Joni Bond, Rajan Kapoor, Arvind Rathod, Habib, Shri Bhagwan",Action Costume,,1968,Music: Robin Bannerjee Lyrics: Bakshi M Khanna
Lutera Aur Jadugar,D. Raman,"Azad, Nishi, Tabassum, Jagdeep, Mohan Choti, Rajan Haksar, Heera Sawant, Noorjehan",Action Fantasy,,1968,"Music: Suresh KumarLyrics: Yogesh, Naseem Zaidi"
Man Ka Meet,A. Subba Rao,"Som Dutt, Leena Chandavarkar, Vinod Khanna, Om Prakash, Achala Sachdev, Rajendranath, Ramesh Deo, Shammi, Nana Palsikar, Ashim Kumar, Manorama",Romance Action,,1968,"Ajanta Pictures, produced by Sunil Dutt. Music: RaviLyrics: Rajendra Krishan"
Mata Mahakali,Dhirubhai Desai,"Shahu Modak, Jayshree Gadkar, Nalini Chonkar, Ashish Kumar, B. M. Vyas, Niranjan Sharma, Mahesh Bhatt (actor), Polson",Mythology,,1968,Music: Avinash VyasLyrics: Bharat Vyas
Mere Hamdam Mere Dost,Amar Kumar,"Dharmendra, Sharmila Tagore, Mumtaz, Rehman, Santosh Kumar, Nigar Sultana, Om Prakash, Achala Sachdev, Snehlata, Khairati, Nazir Kashmiri",Romantic drama,,1968,Music: Laxmikant PyarelalLyrics: Majrooh Sultanpuri
Mere Huzoor,Vinod Kumar,"Raaj Kumar, Jeetendra, Mala Sinha, Laxmi Chhaya, Zeb Rehman, Johnny Walker, K. N. Singh, David, Manorama, Surekha, Indira Billi",Romantic Drama,,1968,Music: Shankar-JaikishanLyrics: Hasrat Jaipuri
Nadir Shah,S. N. Tripathi,"Feroz Khan, Naaz, Sheikh Mukhtar, Murad, Minu Mumtaz, P. Kailash, Hiralal, Sadiq",Historical Action Drama,,1968,Music: S. N. TripathiLyrics: Majrooh Sultanpuri
Neel Kamal,Ram Maheshwari,"Waheeda Rehman, Manoj Kumar, Raaj Kumar, Lalita Pawar, Mehmood, Shashikala, Balraj Sahni","Drama, Romance, Thriller, Musical",,1968,Music: RaviLyrics: Sahir Ludhianvi
Padosan,Jyoti Swaroop,"Sunil Dutt, Mehmood, Saira BanuKishore Kumar, Om Prakash, Dulari, Raj Kishore, Sunder, Agha, Jankidas",Comedy/Musical,,1968,Music: R. D. BurmanLyrics: Rajendra Krishan
Parivar,Kewal P. Kashyap,"Jeetendra, Nanda, Rajendranath, Om Prakash, Sulochana, Tun Tun, Jankidas, Krishan Dhawan",Family Drama,,1968,Music: Kalyanji AnandjiLyrics: Gulshan Bawra
Payal Ki Jhankar,M. V. Raman,"Kishore Kumar, Rajasree, Jyotilaxmi, Rehman, Dhumal, P. Kailash",Romantic melodrama,,1968,Music: C. RamchandraLyrics: Rajendra Krishan
Pinjra,V. Shantaram,"Shriram Lagoo, Sandhya, Nilu Phule, Vatsala Deshmukh, Bhalchandra Kulkarni",Romantic Social Melodrama,,1968,Music: Ram KadamLyrics: Jagdish Khebudkar
Professor and Jadugar,Sultan,"Indrajit, Indira, Khurshid (jr), Indira Bansal, Bob, Poonam Kapoor, Dalpat, Prem Sagar",Action Fantasy,,1968,"Music: Sardar SinghLyrics: Anjaan, K. Malik"
Raaste Aur Manzil,C. Vishwanath,"P. Jairaj, Azra, Sushma, Pratima Devi, Sachin",Social,,1968,Music: Ram KadamLyrics: Ibrahim Faiz
Raja Aur Runk,K. P. Atma,"Sanjeev Kumar, Kumkum, Nazima, Mohan Choti, Ajit, Mukri, Nirupa Roy, Mahesh Kumar, Kamal Kapoor, Aruna Irani, Bipin Gupta, Badri Prasad",Costume Drama,,1968,Music: Laxmikant PyarelalLyrics: Anand Bakshi
Roop Rupaiya,P. L. Santoshi,"Jagdeep, Anita, Jayamala, Roma, Mirza Musharraf, Ulhas, Vivek",Social,,1968,Music: Usha KhannaLyrics: Pyarelal Santoshi
Saathi,C. V. Sridhar,"Vyjayanthimala, Rajendra Kumar, Simi, Pahari Sanyal, David, Sanjeev Kumar, Veena, Sapru, Shabnam, Ram Mohan",Romantic drama,,1968,"Music: NaushadLyrics: Majrooh Sultanpuri, Shakeel Badayuni (Yeh Kaun Aaya)"
Sadhu Aur Shaitaan,A. Bhimsingh,"Om Prakash, Mehmood, Pran, Bharathi, Kishore Kumar, Anwar, Mukri, Jankidas, Tun Tun",Comedy,,1968,Music: Laxmikant PyarelalLyrics: Rajendra Krishan
Sankat Mein Swasthya Aur Safai aka Health and Cleanliness in Crisis,Shantaram Athavale,,Social,,1968,
Sapnon Ka Saudagar,Mahesh Kaul,"Raj Kapoor, Hema Malini, Tanuja, Jayant, Achala Sachdev, David, Durga Khote, Nadira, Roopesh Kumar, Satyen Kappu",Drama,,1968,"Music: Shankar JaikishanLyrics: Hasrat Jaipuri, Shailendra, S. H. Bihari"
Saraswatichandra,Govind Saraiya,"Nutan, Ashish Kumar, Mahesh Desai, Vijaya Chaudhary, Sulochana, Surendra, Ramesh Deo, Seema Deo, B. M. Vyas, Nayampally",Social Drama,,1968,Music: Kalyanji Anandji Lyrics: Indeevar
Shikar,Atma Ram,"Dharmendra, Asha Parekh, Sanjeev Kumar, Rehman, Ramesh Deo, Johnny Walker, Helen, Manmohan, Bela Bose",Action Mystery Thriller,,1968,Music: Shankar JaikishanLyrics: Hasrat Jaipuri
Shrimanji,Ram Dayal,"Kishore Kumar, Shahida, I. S. Johar, Murad, Veena, Meena Rai, Ram Avtar, Hiralal",Comedy,,1968,"Music: O P NayyarLyrics: Aziz Kashmiri, S. H. Bihari"
Spy in Rome,B. K. Adarsh,"Dev Kumar, Jayamala, K. N. Singh, Rajendranath, Lata Sinha, Madhumati",Action Spy Thriller,,1968,Music: Laxmikant PyarelalLyrics: Anand Bakshi
Suhaag Raat,R. Bhattacharya,"Jeetendra, Rajashree, Shabnam, Mehmood, Sulochana, Dhumal, Mehmood Jr., Laxmi Chhaya, Bipin Gupta, Parshuram",Melodrama,,1968,"Music: Kalyanji AnandjiLyrics: Indeevar, Qamar Jalalabadi, Akhtar Romani"
Sunghursh,Harnam Singh Rawail,"Dilip Kumar, Vyjayanthimala, Balraj Sahni, Sanjeev Kumar, Iftekhar, Jayant, Durga Khote, Ulhas, Ulhas, Deven Verma, Sulochana",Drama,,1968,Music: NaushadLyrics: Shakeel Badayuni
Tarzan In Fairyland,Sushil Gupta,"Azad, Indira, Shyam Kumar, Amar Ram Kumar, Ram Mohan, Kumud Tripathi, Nazir Kashmiri",Action Fantasy,,1968,Music: Jimmy PremnathLyrics: Shewan Rizvi
Tatar Ki Hasina,Aslam Ilahabadi,"Raj Gulshan, Nalini Chonkar, Sherry, Murad, Jeevankala, Heera Sawant, Kumud Tripathi",Fantasy,,1968,Music: S. KishanLyrics: Aslam Ilahabadi
Teen Bahuraniyan,"S. S. Balan, S. S. Vasan","Prithviraj Kapoor, Shashikala, Agha, Ramesh Deo, Lalita Pawar, Dhumal, Kanhaiyalal, Jagdeep",Family Comedy,,1968,Music: Kalyanji AnandjiLyrics: Anand Bakshi
Teri Talash Mein,Kewal Mishra,"Sailesh Kumar, Kumkum, Madan Puri, Indira Billi, Mohan Choti, Amarnath, W. M. Khan, Ram Mohan","Murder, Mystery Action",,1968,Music: Sapan-JagmohanLyrics: Naqsh Lyallpuri
Vaasna,T. Prakash Rao,"Raaj Kumar, Padmini, Biswajeet, Tiwari, Kumud Chhugani, Mukri, Sayeeda Khan, Rajendranath",Social Family Drama,,1968,Music: ChitraguptaLyrics: Sahir Ludhianvi
Watan Se Door,Kamran,"Dara Singh, Nishi, Randhawa, Bela Bose, Daisy Irani, Amarnath, Tiwari, Amar, Tun Tun, Habib",Action War,,1968,Music: Lala SattarLyrics: Faruq Kaiser
Aadmi Aur Insaan,,"Dharmendra, Feroz Khan, Saira Banu",,,1969,
Aansoo Ban Gaye Phool,,"Ashok Kumar, Debu Mukherjee, Pran, Anup Kumar, Nirupa Roy, Helen, Alka",,,1969,
Anjaan Hai Koi,Babubhai Mistry,"Feroz Khan, Nalini Chonkar, Aruna Irani, Helen, Tiwari, Mohan Choti",Thriller Suspense,"Music: Usha KhannaLyrics: Asad Bhopali, Usha Khanna, Manohar Khanna, Sardar Bikaneri",1969,
Anjaana,,"Rajendra Kumar, Babita, Pran",,,1969,
Anmol Moti,,"Jeetendra, Babita, Jayant, Jagdeep",,,1969,
Apna Khoon Apna Dushman,Kamran,"Dara Singh, Mumtaz, Randhawa, Tiwari, Shyam Kumar, Sanjana, Tun Tun, Maruti, Habib, Meenaxi Shirodkar, Ulhas",Action,Music: Lala SattarLyrics: Farooq Qaiser,1969,
Aradhana,Shakti Samanta,"Rajesh Khanna, Sharmila Tagore, Farida Jalal, Sujeet Kumar, Ashok Kumar",,,1969,
Aya Sawan Jhoom Ke,,"Dharmendra, Asha Parekh",,,1969,
Badi Didi,,,,,1969,
Balak,,Sarika,,,1969,
Bandhan,,"Rajesh Khanna, Mumtaz, Rupesh Kumar",,,1969,
Beti,,"Nanda, Sanjay Khan",,,1969,
Bhai Bahen,,"Ashok Kumar, Sunil Dutt, Nutan, Pran",,,1969,
Bhuvan Shome,Mrinal Sen,"Utpal Dutt, Suhasini Mulay",,,1969,
Chanda Aur Bijli,,"Jeevan, Padmini, Sachin, Junior Mehmood",,,1969,
Chirag,Raaj Khosla,"Sunil Dutt, Asha Parekh",,,1969,
Dharti Kahe Pukarke,,"Jeetendra, Sanjeev Kumar, Nanda, Kanaiya Lal, Leela Mishra",,,1969,
Do Bhai,,Jeetendra,,,1969,
Do Raaste,,"Rajesh Khanna, Mumtaz, Balraj Sahani, Jayant, Prem Chopra",,,1969,
Doli,,"Rajesh Khanna, Babita",,,1969,
Ek Phool Do Mali,Devendra Goel,"Balraj Sahni, Sanjay Khan, Sadhna",,,1969,
Ek Shriman Ek Shrimati,,"Shashi Kapoor, Babita, Om Prakash, Rajendra Nath",,,1969,
Gunda,,Sujit Kumar,,,1969,
Gustakhi Maaf,,,,,1969,
Hum Ek Hain,,,,,1969,
Insaaf Ka Mandir,,,,,1969,
Intaquam,R. K. Nayyar,"Sadhna, Ashok Kumar, Rehman, Sanjay Khan",,,1969,
Ittefaq,Yash Chopra,"Rajesh Khanna, Nanda, Iftekhaar, Sujit Kumar, Bindu, Gajanan Jagirdar",,,1969,
Jaal Saz,,,,,1969,
Jahan Pyar Mile,Lekh Tondon,"Shashi Kapoor, Hema Malini",,,1969,
Jeene Ki Raah,L.V. Prasad,"Jeetendra, Tanuja, Manmohan Krishn",,,1969,
Jigri Dost,,"Jeetendra, Mumtaz",,,1969,
Jyoti,,"Sanjeev Kumar, Navodita",,,1969,
Khamoshi,,"Rajesh Khanna, Waheeda Rehman, Dharmendra",,,1969,
Madhavi,Chanakya,"Sanjay Khan, Deepa, Pran, Padmini, Mukri, Mehmood, Roopesh Kumar, Murad, Aruna Irani",,,1969,
Mahabaladu,,,,,1969,
Mahal,,"Dev Anand, Asha Parekh",,,1969,
Mahua,,,,,1969,
Mera Dost,,,,,1969,
Mera Yaar Mera Dushman,,,,,1969,
Meri Bhabhi,,,,,1969,
Mr. Murder,Nisar Ahmad Ansari,"Nisar Ahmad Ansari, Nakhi Jahan, Change Usmani",Suspense,,1969,
Mujhe Seene Se Laga Lo,,,,,1969,
Munna,,,,,1969,
Nanha Farishta,,Pran,,,1969,
Nateeja,,,,,1969,
Oos Raat Ke Baad,,,,,1969,
Paisa Ya Pyaar,,,,,1969,
Patthar Ke Khwab,,,,,1969,
Prarthana,,,,,1969,
Prince,,"Shammi Kapoor, Vyjayanthimala",,,1969,
Priya,,,,,1969,
Pujarin,,,,,1969,
Pyaasi Sham,,"Sunil Dutt, Sharmila Tagore",,,1969,
Pyar Hi Pyar,Bhappi Sonie,"Dharmendra, Vyjayanthimala, Pran, Mehmood Ali, Madan Puri, Helen, Salim Khan, Dhumal, Mehmood Jr., Sulochana Latkar",Romance,Music: Shankar JaikishanLyrics: Hasrat Jaipuri,1969,
Pyar Ka Mausam,,"Shashi Kapoor, Asha Parekh",,,1969,
Pyar Ka Sapna,Hrishikesh Mukherjee,"Ashok Kumar, Mala Sinha, Biswajeet, Johnny Walker",,,1969,
Rahgir,Tarun Majumdar,"Biswajeet, Sandhya Roy, Shashikala, Kanhaiyalal, Iftekhar, Nirupa Roy, Asit Sen, Padma, Vasant Choudhary","Romantic, Social, Drama",Music: Hemant KumarLyrics: Gulzar,1969,
Raja Saab,Suraj Prakash,"Shashi Kapoor, Nanda",,Music: Kalyanji Anandji,1969,
Rakhi Rakhi,,,,,1969,
Road to Sikkim,Ravindra Dave,"Dev Kumar, Anju Mahendru",,,1969,
Saat Hindustani,Khwaja Ahmad Abbas,"Utpal Dutt, Madhu, Jalal Agha, Amitabh Bachchan",,Debut appearance of Amitabh Bachchan,1969,
Sachaai,,"Shammi Kapoor, Sanjeev Kumar, Babita, Pran",,,1969,
Sajan,,"Manoj Kumar, Asha Parekh, Madan Puri, Shatrughan Sinha",,,1969,
Samay Bada Balwan,Sohrab Modi,"Sohrab Modi, Sailesh Kumar, Shahida[disambiguation needed], Mehtab, Aruna Irani, Helen",Social Drama,Music: Usha KhannaLyrics: D. N. Madhok,1969,
Sansar Leela,,,,,1969,
Sara Akash,,,,,1969,
Satyakam,,"Dharmendra, Sanjeev Kumar",,,1969,
Shart,,,,,1969,
Shatranj,,"Rajendra Kumar, Waheeda Rehman, Mehmood",,,1969,
Simla Road,,,,,1969,
Surya Devata,,,,,1969,
Talash,O.P. Ralhan,"Rajendra Kumar, Sharmila Tagore",,,1969,
Tamanna,,,,,1969,
The Gold Medal,Ravikant Nagaich,"Dharmendra, Jeetendra, Bindu",,,1969,
Thief of Baghdad,Shriram Bohra,"Dara Singh, Nishi, Helen, B. M. Vyas",,,1969,
Toofan,,,,,1969,
Tumse Achha Kaun Hai,Pramod Chakravorty,"Shammi Kapoor, Babita, Pran",,,1969,
Vishwas,,"Jeetendra, Aparna Sen",,Kalyanji Anandji,1969,
Wapas,,,,,1969,
Wardrobe,,,,,1969,
Waris,Ramanna,"Jeetendra, Hema Malini, Mehmood Ali, Aruna Irani, Prem Chopra, Nazima, David, Kamini Kaushal, Sudesh Kumar, Sunder, Sachin Pilgaonkar",Family Romance Action,Music: R. D. Burman<Lyrics: Rajendra Krishan,1969,
Yakeen,,"Dharmendra, Sharmila Tagore",,,1969,
