Title,Director,Cast,Genre,Sources,Year,Sources / notes,sources
Gol Maal,Hrishikesh Mukherjee,"Amol Palekar, Utpal Dutt",Comedy,,1979,,
Gopal Krishna,Vijay Sharma,"Sachin, Zarina Wahab",Romance,,1979,,
The Great Gambler,Shakti Samanta,"Amitabh Bachchan, Zeenat Aman, Neetu Singh, Prem Chopra, Utpal Dutt",Action,,1979,,
Griha Pravesh,Basu Bhattacharya,"Sanjeev Kumar, Sharmila Tagore, Sarika",Romance,,1979,,
Hamare Tumhare,Umesh Mehra,"Sanjeev Kumar, Raakhee Gulzhar, Amjad Khan, Prem Krishen, Anil Kapoor, Lucky Ali, Amrish Puri",Romance,,1979,,
Har Har Gange,Babubhai Mistri,"Ashish Kumar, Anjana Mumtaz, Vikram Gokhale","Fantasy, Drama",,1979,,
Heera-Moti,,"Shatrughan Sinha, Reena Roy, Danny Denzongpa",Action,,1979,,
Hum Tere Ashiq Hain,Prem Sagar,"Jeetendra, Hema Malini, Amjad Khan",Romance,,1979,,
Jaan-e-Bahaar,Prakash Kapur,"Sachin, Sarika",Romance,,1979,,
Jaandaar,S. K. Luthra,"Jeetendra, Vinod Mehra, Bindiya Goswami, Asrani, Aruna Irani",Drama,,1979,,
Jaani Dushman,Nishi Films,"Sunil Dutt, Sanjeev Kumar, Reena Roy, Shatrughan Sinha, Rekha, Vinod Mehra, Jeetendra, Neetu Singh",Horror,,1979,,
Janata Havaldar,,"Rajesh Khanna, Hema Malini, Yogita Bali",Romance,,1979,,
Jeena Yahan,Basu Chatterjee,"Amol Palekar, Shekar Kapur, Shabana Azmi",Romance,,1979,,
Jhoota Kahin Ka,Ravi Tandon,"Rishi Kapoor, Neetu Singh, Rakesh Roshan, Prem Chopra",Romance,,1979,,
Jurmana,,"Amitabh Bachchan, Rakhee Gulzar, Vinod Mehra",Romance,,1979,,
Kaala Patthar,Yash Chopra,"Amitabh Bachchan, Shashi Kapoor, Raakhee Gulzar, Shatrughan Sinha, Parveen Babi, Neetu Singh, Mac Mohan",Action,,1979,,
Kartavya,Mohan Sehgal,"Dharmendra, Rekha, Vinod Mehra",,,1979,,
Khandan,Anil Ganguly,"Jeetendra, Bindiya Goswami, Nirupa Roy","Family, Drama",,1979,,
Lahu Ke Do Rang,Mahesh Bhatt,"Vinod Khanna, Shabana Azmi",Romance,,1979,,
Lakhan,,"Navin Nischol, Padma Khanna, Ranjeeta Kaur",Drama,,1979,,
Lok Parlok,Tatineni Rama Rao,"Jeetendra, Jayapradha, Amjad Khan",Drama,,1979,,
Love in Canada,S. Ramanathan,"Vinod Mehra, Jeetendra, Moushumi Chatterjee",Romance,,1979,,
Maan Apmaan,N. V. Deshpande,"Sanjeev Kumar, Kanan Kaushal",Drama,,1979,,
Magroor,Brij Sadanah,"Shatrughan Sinha, Vidya Sinha",Romance Drama,,1979,,
Mata Velankanni (Dubbed from Tamil),K. Thangappan,Gemini Ganesan Jayalalitha,Devotion,,1979,,
Manzil,Basu Chatterjee,"Amitabh Bachchan, Moushumi Chatterjee",Drama,,1979,,
Meera,Gulzar,"Shammi Kapoor, Hema Malini, Vinod Khanna",Drama,,1979,,
Meri Biwi Ki Shaadi,Rajat Rakshit,"Amol Palekar, Ranjeeta Kaur",Comedy,,1979,,
Mr. Natwarlal,Rakesh Kumar[disambiguation needed],"Amitabh Bachchan, Rekha, Amjad Khan, Ajit Khan, Kader Khan","Action, Drama",,1979,,
Muqabla,Rajkumar Kohli,"Sunil Dutt, Rajesh Khanna, Shatrughan Sinha, Reena Roy",Action,,1979,,
Nagin Aur Suhagin,Shantilal Soni,"Vijay Arora, Mahesh Bhatt, Rita Bhaduri",Drama,,1979,,
Naiyya,Prashanta Nanda,"Prashanta Nanda, Zarina Wahab, Baldev Khosa",Drama,,1979,,
Nauker,Ismail Memon,"Sanjeev Kumar, Jaya Badhuri",Comedy,,1979,,
Noorie,Manmohan Krishna,"Farooq Shaikh, Poonam Dhillon",Drama,,1979,,
Prem Bandhan,Ramanand Sagar,"Rajesh Khanna, Rekha, Moushumi Chatterjee",Romance,,1979,,
Prem Vivah,Basu Chatterjee,"Mithun Chakraborthy, Asha Parekh, Bindiya Goswami",Romance,,1979,,
Raadha Aur Seeta,Vijay Kapoor,"Arun Govil, Rita Bhaduri",Romance,,1979,,
Raakhi Ki Saugandh,Shibu Mitra,"Rajan Haskar, Ajit, Vinod Mehra, Sarika",Drama,,1979,,
Raja Harishchandra,Asish Kumar,"Asish Kumar, Lalita Pawar",Mythology,,1979,,
Ratnadeep,Basu Chatterjee,"Girish Karnad, Hema Malini, A. K. Hangal",Drama,,1979,,
Saanch Ko Aanch Nahin,Satyen Bose,"Arun Govil, Urmila Bhatt, Om Puri",Drama,,1979,,
Salaam Memsaab,Asrani,"Yogeeta Bali, Zarina Wahab, Asrani",Drama,,1979,,
Sampark,Inder Sen,"Madhu Kapoor, Girish Karnad, Mazar Khan",Drama,,1979,,
Sargam,K. Vishwanath,"Rishi Kapoor, Jayapradha, Shakti Kapoor",Romance,,1979,,
Sarkari Mehmaan,N. D. Kothari,"Vinod Khanna, Padma Khanna, Amjad Khan",Drama,,1979,,
Sawan Ko Aane Do,Kanak Mishra,"Arun Govil, Zarina Wahab, Rita Bhaduri",Romance,,1979,,
Shaayad,,"Naseeruddin Shah, Om Puri, Simi Garewal",Drama,,1979,,
Shabhash Daddy,Kishore Kumar,"Kishore Kumar, Amit Kumar, Yogita Bali",Romance,,1979,,
Shikshaa,S. Ramanathan,"Raj Kiran, Sushma Verma, Beena Bannerjee",Drama,,1979,,
Shodh,Biblap Roy Chowdhary,Om Puri,Horror,,1979,,
Solva Sawan,Bharathi Raja,"Amol Palekar, Sridevi",Romance,,1979,,
Suhaag,Manmohan Desai,"Amitabh Bachchan, Shashi Kapoor, Rekha, Parveen Babi, Nirupa Roy, Amjad Khan, Kader Khan, Ranjeet, Jeevan",Romance,,1979,,
Sunayana,Hiren Nag,"Naseeruddin Shah, Sulochana Latkar",Drama,,1979,,
Surakshaa,Ravikant Nagaich,"Mithun Chakraborthy, Ranjeeta Kaur",Romance,,1979,,
Taraana,Deepak Bahry,"Mithun Chakraborthy, Ranjeeta Kaur",Romance,,1979,,
Teen Chehre,,Pran,,,1979,,
Tere Pyar Mein,,,,,1979,,
Yuvraaj,T R Ramanna,"Vinod Khanna, Neetu Singh, Jaya Malini, Aruna Irani",Romance,,1979,,
