Title,Director,Cast,Genre,Sources,Year,Sources / notes,sources
Chor Chor,Prem Prakash,"Vijay Anand, Leena Chandavarkar",Drama,,1974,,
Chor Machaye Shor,Ashok Roy,"Shashi Kapoor, Mumtaz",Drama,,1974,,
Chorus,Mrinal Sen,"Utpal Dutt, Ajit Baneerjee",Fantasy,,1974,,
Chowkidar,Shyam Ralhan,"Yogeeta Bali, Vinod Khanna",Drama,,1974,,
Dawat,B.R. Ishara,Dilip Dutt,Drama,,1974,,
Dhuen Ki Lakeer,Kishore Sahu,Parveen Babi,Drama,,1974,,
Dil Diwana,Narendra Bedi,"Jaya Bachchan, Aruna Irani",Drama,,1974,,
Do Aankhen,Ajoy Biswas,Rekha,Drama,,1974,,
Do Chattane,G.H. Sarin,Aruna Irani,Drama,,1974,,
Do Nambar Ke Amir,P.D. Shenoy,Asha Sachdeva,Drama,,1974,,
Doosri Sita,Gogi Anand,"Jaya Bachchan, Lalita Pawar",Drama,,1974,,
Dost,Dulal Guha,"Dharmendra, Hema Malini",Drama,,1974,,
Duniya Ka Mela,Kundan Kumar,"Rekha, Sanjay Khan",Drama,,1974,,
Ek Anek Aur Ekta,Bhimsian,,Animation,,1974,,
Farebi,Suresh Issar,"Vinod Khanna, Bindu",Drama,,1974,,
Faslah,Khwaja Ahmad Abbas,"Shabana Azmi, Vinod Mehra",Drama,,1974,,
Geeta Mera Naam,Sadhana Shivdasani,"Sunil Dutt, Feroz Khan, Sadhana Shivdasani",Drama,,1974,,
Goonj,S.U. Syed,"Rakesh Roshan, Reena Roy, Mahendra Sandhu","Horror, Thriller",,1974,,
Haath Ki Safai,Prakash Mehra,"Vinod Khanna, Randhir Kapoor",Drama,,1974,,
Hamrahi,Saawan Kumar Tak,"Tanuja, Randhir Kapoor",,,1974,,
Hanuman Vijay,Babubhai Mistri,Raaj Kumar,Mythology,,1974,,
Har Har Mahadev,Chandrakant,"Aruna Irani, Dara Singh",Mythology,,1974,,
Hawas,Saawan Kumar Tak,"Rekha, Neetu Singh, Anil Dhawan",,,1974,,
Hum Rahi,Anand Sagar,"Randhir Kapoor, Tanuja",,,1974,,
Humshakal,Jambulingam,"Rajesh Khanna, Tanuja",Thriller,,1974,,
Imaan,Padmanabh,"Sanjeev Kumar, Leena Chandavarkar",Romance,,1974,,
Imtihaan,Madan Sinha,"Vinod Khanna, Tanuja",Drama,,1974,,
Insaaniyat,Prayag Raj,"Shashi Kapoor, Sujit Kumar",Drama,,1974,,
International Crook,Pachhi,"Dharmendra, Saira Banu, Feroz Khan",Crime,,1974,,
Ishk Ishk Ishk,Dev Anand,"Dev Anand, Shabana Azmi, Zeenat Aman",Romance,,1974,,
Jab Andhera Hota Hai,Deepak Bahry,"Madan Puri, Prem Chopra",Thriller,,1974,,
Jadu Ka Shankh,Sai Paranjape,Kulbhushan Kharbanda,,,1974,,
Jai Radhe Krishna,Yeshwant Pethkar,Moha Choti,,,1974,,
Jeevan Rekha,Nanubhai Bhatt,"Tabrez, Farida Jalal, Pran, K. N. Singh, Ajit Khan, Jalal Aga, Keshto Mukherjee, Chandrashekhar, Asit Sen",,,1974,,
Jeevan Sangram,,"Shashi Kapoor, Iftekhar",,,1974,,
Jurm Aur Sazaa,Nisar Ahmad Ansari,"Vinod Mehra, Nisar Ahmad Ansari",,,1974,,
Kasauti,Aravind Sen,"Amitabh Bachchan, Hema Malini, Pran",Drama,,1974,,
Khote Sikkay,Narendra Bedi,"Danny Denzongpa, Feroz Khan",,,1974,,
Khoon Ki Keemat,Shibu Mitrav,Ashok Kumar,,,1974,,
Kisan Aur Bhagwan,Chandrakant,"Dara Singh, Feroz Khan",,,1974,,
Kora Badan,B.S. Ghad,"Sunil Dutt, Mala Sinha",,,1974,,
Kora Kagaz,Anil Ganguly,"Vijay Anand, Jaya Bachchan",Romance,,1974,,
Kunwara Baap,Mehmood Ali,"Mehmood Ali, Vinod Mehra, Bharathi Vishnuvardhan, Lalita Pawar, Sanjeev Kumar",Comedy,,1974,,
Maa Bahen Aur Biwi,Harbans Kumar,"Kabir Bedi, Raj Kishore",Drama,,1974,,
Madhosh,Desh Gautam,"Rakesh Roshan, Reena Roy",Drama,,1974,,
Majboor,Ravi Tandon,"Amitabh Bachchan, Parveen Babi, Farida Jalal, Pran",Drama,,1974,,
Manoranjan,Shammi Kapoor,"Shammi Kapoor, Sanjeev Kumar, Zeenat Aman",Romance,,1974,,
Manzilein Aur Bhi Hain,Mahesh Bhatt,"Kabir Bedi, Mukesh Bhatt",Drama,,1974,,
Mere Saath Chal,,"Smita Patil, Farooq Shaikh",Drama,,1974,,
Mr. Romeo,Subhash Mukherjee,"Shashi Kapoor, Rinku Jaiswal",Drama,,1974,,
Naya Din Nai Raat,A. Bhimsingh,"Sanjeev Kumar, Jaya Bachchan",Drama,,1974,,
Nirmaan,Ravi Tandon,Anoop Kumar,Drama,,1974,,
Parinay,Kantilal Rathod,"Romesh Sharma, Shabana Azmi, Asha Sachdev",Social,,1974,Awarded Best Feature Film on National Integration,
Phir Kab Milogi,Hrishikesh Mukherjee,Mala Sinha,,,1974,,
Pocket Maar,Ramesh Lakhanpal,"Dharmendra, Saira Banu",Drama,,1974,,
Pran Jaye Par Vachan Na Jaye,S. Ali Raza,"Sunil Dutt, Rekha, Iftekhar",Drama,,1974,,
Rajnigandha,Basu Chatterjee,"Amol Palekar, Vidya Sinha",Romance,,1974,,
Resham Ki Dori,Atma Ram,"Dharmendra, Saira Banu",Drama,,1974,,
Roti,Manmohan Desai,"Rajesh Khanna, Mumtaz",Romance,,1974,,
Roti Kapda Aur Makaan,Manoj Kumar,"Manoj Kumar, Shashi Kapoor, Amitabh Bachchan, Zeenat Aman",Drama,,1974,,
Sagina,Tapan Sinha,"Dilip Kumar, Saira Banu",Drama,,1974,,
Vachan,Suraj Prakash,"Shashi Kapoor, Vimi",,,1974,,
Zehreela Insaan,S.R. Puttana Kanagal,"Rishi Kapoor, Moushumi Chatterjee, Neetu Singh, Pran, Nirupa Roy, Dara Singh, Iftekhar, Madan Puri, Paintal",,,1974,,
Aaja Sanam,Yusuf Naqvi,"Feroz Khan, Tanuja",Romance,,1975,,
Aag Aur Toofan,Tanvir Ahmed,"Mumtaz, Robin Kumar, Anwar Hussain, Rajan Haskar",,,1975,,
Aakhri Daao,,"Jeetendra, Saira Banu",,Writer - Salim / Javed,1975,,
Aakraman,J. Om Prakash,"Ashok Kumar, Sanjeev Kumar, Rekha, Rakesh Roshan, Rajesh Khanna",,,1975,,
Aandhi,Gulzar,"Suchitra Sen, Sanjeev Kumar",Drama,,1975,,
Alakh Niranjan,,,,,1975,,
Amanush,Shakti Samanta,"Uttam Kumar, Sharmila Tagore, Utpal Dutt",,,1975,,
Anari,Asit Sen,"Shashi Kapoor, Sharmila Tagore, Moushumi Chatterjee, Kabir Bedi, Kader Khan",Romance,,1975,,
Andhera,,"Sameer Khan, Vani Ganpati",,,1975,,
Andolan,Lekh Tandon,"Rakesh Pandey, Neetu Singh",,,1975,,
Anokha,Jugal Kishore,"Shatrughan Sinha, Zareena Wahab (first film)",,,1975,,
Apne Dushman,,Reena Roy,,,1975,,
Apne Rang Hazaar,Ravi Tandon,"Sanjeev Kumar, Leena Chandavarkar, Danny Denzongpa, Bindu",,,1975,,
Badnaam,Dilip Bose,"Nazima, Baldev Khosa, Sujit Kumar, Jalal Agha",Drama,[2],1975,,
Balak Aur Janwar,Nanabhai Bhatt,"Mohan Choti, Dulari, Kanan Kaushal, Baldev Khosa",,,1975,,
Biwi Kiraya Ki,,,,,1975,,
Chaitali,Hrishikesh Mukherjee,"Dharmendra, Saira Banu",,,1975,,
Charandas Chor,,Smita Patil's first movie,,,1975,,
Chori Mera Kaam,,"Shashi Kapoor, Zeenat Aman, Pran",,,1975,,
Chupke Chupke,Hrishikesh Mukherjee,"Dharmendra, Amitabh Bachchan, Jaya Badhuri, Sharmila Tagore",Romance,,1975,,
Dafaa 302,,"Randhir Kapoor, Rekha",,,1975,,
Deewaar,Yash Chopra,"Amitabh Bachchan, Shashi Kapoor, Neetu Singh, Parveen Babi",Drama,,1975,,
Dharam Karam,Raj Kapoor,"Raj Kapoor, Randhir Kapoor, Rekha",,,1975,,
Dharmatma,Feroz Khan,"Feroz Khan, Hema Malini, Rekha, Danny Denzongpa, Ranjeet, Jeevan","Action, Thriller",,1975,,
Dhoti Lota Aur Chowpatty,,,,,1975,,
Do Jasoos,,"Shailendra Singh, Bhavna Bhatt, Raj Kapoor, Rajendra Kumar",,,1975,,
Do Jhoot,,"Vinod Mehra, Moushumi Chatterjee, Pran",,,1975,,
Do Thug,,"Shatrughan Sinha, Hema Malini",,,1975,,
Dulhan,C.V. Rajendran,"Jeetendra, Hema Malini",Drama,,1975,,
Ek Mahal Ho Sapno Ka,,"Dharmendra, Sharmila Tagore, Leena Chandavarkar",,,1975,,
Faraar,,"Sanjeev Kumar, Sharmila Tagore, Amitabh Bachchan",,,1975,,
Geet Gaata Chal,Hiren Nag,"Sachin, Sarika, Urmila Bhatt","Drama, Family, Musical, Comedy",,1975,,
Hero,,,,,1975,,
Himalay Se Ooncha,B. S. Thapa,"Sunil Dutt, Mallika Sarabhai, Ranjeet, Master Raju, Baby Bittoo",Adventure,,1975,,
Jaan Hazir Hai,,"Shekhar Kapur, Prem kishan Prema, Naraen Dir, Vijay Anand",,,1975,,
Jaggu,,"Shatrughan Sinha, Leena Chandavarkar",,,1975,,
Jai Santoshi Maa,Vijay Sharma,"Bharat Bhushan, Kanan Kaushal",,,1975,,
Julie,K. S. Sethumadhavan,"Vikram Makandar, Lakshmi, Nadira, Om Prakash",,Sridevi (child artist),1975,,
Kaagaz Ki Nao,,"Raj Kiran, Sarika",,,1975,,
Kahte Hain Mujhko Raja,,"Dharmendra, Hema Malini, Biswajeet, Rekha",,,1975,,
Kala Sona,,"Feroz Khan, Parveen Babi",,,1975,,
Khel Khel Mein,Ravi Tandon,"Rishi Kapoor, Neetu Singh, Rakesh Roshan",Drama,,1975,,
Khushboo,Gulzar,"Jeetendra, Hema Malini, Sharmila Tagore",Drama,,1975,,
Lafange,Harmesh Malhotra,"Randhir Kapoor, Mumtaz, Pran",Drama,,1975,,
Mausam,Gulzar,"Sanjeev Kumar, Sharmila Tagore",Romance,,1975,,
Mazaaq,,"Vinod Mehra, Moushumi Chatterjee",,,1975,,
Mere Sajna,,"Navin Nischol, Raakhee",,,1975,,
Mere Sartaj,,"Zaheera, Satish Kaul",,,1975,,
Mili,Hrishikesh Mukherjee,"Amitabh Bachchan, Jaya Badhuri, Ashok Kumar",Romance,,1975,,
Natak,,"Vijay Arora, Moushumi Chatterjee",,,1975,,
Neelima,,Zahida,,,1975,,
Nishant,Shyam Benegal,"Anant Nag, Shabana Azmi, Sadhu Meher",,,1975,,
Ponga Pandit,,"Randhir Kapoor, Nita Mehta, Prema Narayan, Danny Denzongpa",,,1975,,
Pratigya,Dulal Guha,"Dharmendra, Hema Malini, Ajit Khan",Action,,1975,,
Prem Kahani,Raj Khosla,"Rajesh Khanna, Mumtaz, Shashi Kapoor, Vinod Khanna",Drama,,1975,,
Qaid,Atma Ram,"Vinod Khanna, Leena Chandavarkar, Mehmood Ali",Action,,1975,,
Rafoo Chakkar,,"Rishi Kapoor, Neetu Singh, Paintal",,,1975,,
Raftaar,,"Vinod Mehra, Moushumi Chatterjee",,,1975,,
Raja,,"Rishi Kapoor, Sulakshana Pandit",,,1975,,
Rani Aur Lalpari,,"Jeetendra, Reena Roy, Neetu Singh, Asha Parekh, Feroz Khan",,,1975,,
Saazish,Kalidas,"Dharmendra, Saira Banu","Action, Thriller Suspense",,1975,,
Salaakhen,,"Shashi Kapoor, Sulakshana Pandit",,,1975,,
Sankalp,,,,,1975,,
Sanyasi,Sohanlal Kanwar,"Manoj Kumar, Hema Malini, Prem Chopra, Pran",Drama,,1975,,
Sewak,,"Vinod Khanna, Neetu Singh",,,1975,,
Sholay,Ramesh Sippy,"Sanjeev Kumar, Dharmendra, Amitabh Bachchan, Amjad Khan, Hema Malini, Jaya Badhuri, Mac Mohan, Sachin, Asrani, Jagdeep","Drama, Action, Romance",,1975,,
Sunehra Sansar,,"Rajendra Kumar, Hema Malini",,,1975,,
Toofan,,"Vikram, Priyadarshini",,,1975,,
Toofan Aur Bijlee,Homi Wadia,"Zaheera, Arvind Kumar, Imtiaz, Randhawa, Bhagwan, Tun Tun, Mohan Choti, Habib",Action,,1975,,
Tumhara Kalloo,,,,,1975,,
Uljhan,,"Sanjeev Kumar, Sulakshana Pandit",,,1975,,
Umar Qaid,Sikandar Khanna,"Jeetendra, Vinod Mehra, Sunil Dutt, Reena Roy, Moushumi Chatterjee",,,1975,,
Vandana,,,,,1975,,
Vardaan,Arun Bhatt,"Vinod Mehra, Reena Roy, Mehmood",Drama,,1975,,
Warrant,,"Dev Anand, Zeenat Aman, Pran",,,1975,,
Zakhmee,,"Sunil Dutt, Asha Parekh, Reena Roy, Rakesh Roshan, Tariq Khan",,,1975,,
Zameer,,"Amitabh Bachchan, Saira Banu, Shammi Kapoor, Vinod Khanna",,,1975,,
Zinda Dil,,"Rishi Kapoor, Neetu Singh, Zaheera, Pran",,,1975,,
Zindagi Aur Toofan,,"Sajid Khan, Rehana Sultan, Yogeeta Bali",,,1975,,
Zorro,,"Navin Nischol, Rekha",,,1975,,
Aaj Ka Mahaatma,Kundan Kumar,"Randhir Kapoor, Rekha, Ranjeet, Bindu",Romantic Action,,1976,,
Aaj Ka Ye Ghar,,,,,1976,,
Aap Beati,,"Shashi Kapoor, Hema Malini",,,1976,,
Aarambh,,,,,1976,,
Adalat,,"Amitabh Bachchan, Waheeda Rehman",,,1976,,
Ali Baba,,Dharmendra,,,1976,,
Arjun Pandit,,"Sanjeev Kumar, Vinod Mehra, Shabana Azmi",,,1976,,
Bairaag,Asit Sen,"Dilip Kumar, Saira Banu, Leena Chandavarkar",,,1976,,
Bajrangbali,,"Biswajeet, Moushumi Chatterjee, Shashi Kapoor",Mythology,,1976,,
Balika Badhu,Tarun Majumdar,"Sachin, Rajni Sharma, Asrani",,,1976,,
Barood,Pramod Chakraborty,"Rishi Kapoor, Shoma Anand",,,1976,,
Bhala Manus,,"Randhir Kapoor, Neetu Singh",,,1976,,
Bhanwar,,,,,1976,,
Bullet,,"Dev Anand, Parveen Babi",,,1976,,
Bundal Baaz,,"Rajesh Khanna, Sulakshana Pandit",,,1976,,
Chalte Chalte,Sunder Dar,"Simi Garewal, Vishal Anand",,Music by Bappi Lahiri,1976,,
Charas,,"Dharmendra, Hema Malini",,,1976,,
Chhoti Si Baat,Basu Chatterjee,"Ashok Kumar, Vidya Sinha, Amol Palekar",,,1976,,
Chitchor,Basu Chatterjee,"Amol Palekar, Zarina Wahab, Vijayendra Ghatge, Dina Pathak",,,1976,,
Deewaangee,,"Shashi Kapoor, Zeenat Aman",,,1976,,
Do Anjaane,,"Amitabh Bachchan, Rekha, Prem Chopra",,,1976,,
Do Khiladi,Binod Mehra,,,,1976,,
Do Ladkiyan,,,,,1976,,
Dus Numbri,,"Manoj Kumar, Hema Malini, Premnath, Pran",,,1976,,
Ek Se Badhkar Ek,,"Ashok Kumar, Sharmila Tagore",,,1976,,
Fakira,C. P. Dixit,"Shashi Kapoor, Shabana Azmi, Danny Denzongpa",Action,,1976,,
Ginny Aur Johnny,,"Mehmood, Nutan, Helen, Hema Malini",,,1976,,
Gumrah,,,,,1976,,
Hera Pheri,Manmohan Desai,"Amitabh Bachchan, Vinod Khanna, Saira Banu, Sulakshana Pandit",,,1976,,
Jaaneman,,"Dev Anand, Hema Malini, Premnath",,,1976,,
Jai Jagat Janani,,"Gemini Ganesan, Jayalalitha",,,1976,,
Jeevan Jyoti,,"Vijay Arora, Bindiya Goswami",,,1976,,
Kabeela,,"Feroz Khan, Rekha, Bindu",,,1976,,
Kabhie Kabhie,Yash Chopra,"Amitabh Bachchan, Shashi Kapoor, Raakhee, Rishi Kapoor, Waheeda Rehman, Neetu Singh",Romance,,1976,,
Kadambari,,"Vijay Arora, Shabana Azmi, Chand Usmani",,,1976,,
Kalicharan,Subhash Ghai,"Shatrughan Sinha, Reena Roy, Premnath",,,1976,,
Khaan Dost,,"Shatrughan Sinha, Mithu Mukherjee",,,1976,,
Khalifa,,"Randhir Kapoor, Rekha, Pran",,,1976,,
Koi Jeeta Koi Haara,,"Shashi Kapoor, Saira Banu",,,1976,,
Lagaaam,,,,,1976,,
Laila Majnu,,"Rishi Kapoor, Ranjeeta, Danny Dengzongpa",,,1976,,
Maa,,"Dharmendra, Hema Malini",,,1976,,
Maha Chor,,"Rajesh Khanna, Neetu Singh",,,1976,,
Manthan,Shyam Benegal,"Naseeruddin Shah, Smita Patil, Girish Karnad, Amrish Puri",Drama,,1976,,
Mazdoor Zindabaad,,,,,1976,,
Mehbooba,,"Rajesh Khanna, Hema Malini, Yogeeta Bali, Prem Chopra",,,1976,,
Mrigayaa,Mrinal Sen,"Mithun Chakraborty, Mamata Shankar, Anoop Kumar",Drama,,1976,,
Naach Uthe Sansaar,,"Shashi Kapoor, Hema Malini",,,1976,,
Nagin,Raj Kumar Kohli,"Sunil Dutt, Feroz Khan, Sanjay Khan, Jeetendra, Kabir Bedi, Vinod Mehra, Rekha, Mumtaz, Reena Roy, Ranjeet",,,1976,,
Nehle Pe Dehla,,"Sunil Dutt, Vinod Khanna, Saira Banu",,,1976,,
Rakhi Aur Rifle,,,,,1976,,
Raksha Bandhan,,,,,1976,,
Rangila Ratan,,"Rishi Kapoor, Parveen Babi",,,1976,,
Sabse Bada Rupaiya,,"Vinod Mehra, Moushumi Chatterjee, Mehmood",,,1976,,
Sajjo Rani,Govind Saraiya,"Ramesh Deo, Ramesh Sharma, Rehana Sultan",,,1976,,
Sangat,,,,,1976,,
Sangram,Harmesh Malhotra,"Shatrughan Sinha, Reena Roy","Drama, Action",,1976,,
Santan,,,,,1976,,
Shahi Lutera,,,,,1976,,
Shankar Dada,,"Shashi Kapoor, Neetu Singh, Pran",,,1976,,
Shankar Shambhu,,"Feroz Khan, Vinod Khanna",,,1976,,
Shaque,,"Vinod Khanna, Shabana Azmi",,,1976,,
Sharafat Chod Di Maine,,"Feroz Khan, Hema Malini",,,1976,,
Sikandar,,,,,1976,,
Sita Swayamvar,,,,,1976,,
Tapasya,,"Raakhee, Parikshit Sahani",,,1976,,
Udhar Ka Sindur,,"Jeetendra, Reena Roy",,,1976,,
Veer Bhagdavalo,,,,,1976,,
Zamane Se Poocho,,,,,1976,,
Zid,,,,,1976,,
Zindagi,,"Sanjeev Kumar, Vinod Mehra, Mala Sinha, Moushumi Chatterjee, Aruna Irani, A.K Hangal, Deven Verma",,,1976,,
Aadmi Sadak Ka,Devendra Goel,"Shatrughan Sinha, Vikram, Zaheera, Sujit Kumar, Deven Verma",,,1977,,
Aafat,Atma Ram,"Navin Nischol, Leena Chandavarkar, Amjad Khan, Mehmood",,,1977,,
Aaina,K. Balachander,"Rajesh Khanna, Mumtaz, A. K. Hangal, Nirupa Roy, Lalita Pawar",,,1977,,
Aakhri Goli,Shibu Mitra,"Sunil Dutt, Leena Chandavarkar, Farida Jalal, Amjad Khan, Om Prakash",Action,,1977,,
Aakhri Sajda,,"Mala Sinha, Murad, Helen, Jagdeep",,,1977,,
Aap Ki Khatir,Sudhendu Roy,"Vinod Khanna, Rekha, Nadira, Helen, Tun Tun, Om Shivpuri",,,1977,,
Aashiq Hoon Baharon Ka,J. Om Prakash,"Rajesh Khanna, Zeenat Aman, Danny Denzongpa, Preeti Ganguli",Romance,,1977,,
Ab Kya Hoga,Sawan Kumar,"Shatrughan Sinha, Neetu Singh, Asrani, Bindu, Moushumi Chatterjee, Ranjeet",,,1977,,
Abhi To Jee Lein,Roshan Taneja,"Jaya Bhaduri, Danny Denzongpa, Simi Garewal, Iftekhar",,,1977,,
Adalat,Narendra Bedi,"Amitabh Bachchan, Waheeda Rehman, Neetu Singh",,,1977,,
Adha Din Adhi Raat,Doondi,,,,1977,,
Agar... If,Esmayeel Shroff,,,,1977,,
Agent Vinod,Deepak Bahry,"Mahendra Sandhu, Pinchu Kapoor",,,1977,,
Alaap,Hrishikesh Mukherjee,"Amitabh Bachchan, Rekha",,,1977,,
Alibaba Marjinaa,Kedar Kapoor,"Prem kishan, Tamanna, Urmila Bhatt, Birbal, Jagdeep, Pinchoo Kapoor, Shakti Kapoor",,,1977,,
Amaanat,Shatrujit Paul,"Manoj Kumar, Sadhana Shivdasani, Balraj Sahni, Mehmood",,,1977,,
Amar Akbar Anthony,Manmohan Desai,"Amitabh Bachchan, Rishi Kapoor, Vinod Khanna, Neetu Singh, Shabana Azmi, Parveen Babi, Pran, Nirupa Roy, Jeevan, Ranjeet, Yusuf Khan",Romance,,1977,,
Anand Ashram,,,,,1977,,
Angaare,,,,,1977,,
Anurodh,Shakti Samanta,"Ashok Kumar, Rajesh Khanna, Simple Kapadia, Vinod Mehra",,,1977,,
Apnapan,J. Om Prakash,"Jeetendra, Sulakshana Pandit, Reena Roy",,,1977,,
Bhumika,Shyam Benegal,"Smita Patil, Naseeruddin Shah, Amrish Puri",Drama,,1977,,
Chaani,,,,,1977,,
Chacha Bhatija,Manmohan Desai,"Dharmendra, Randhir Kapoor, Hema Malini",Drama,,1977,,
Chakkar Pe Chakkar,,"Shashi Kapoor, Pran",,,1977,,
Chala Murari Hero Banne,Asrani,"Asrani, Bindiya Goshwami",,,1977,,
Chalta Purza,,"Rajesh Khanna, Parveen Babi",,,1977,,
Chandi Sona,,"Sanjay Khan, Praveen Babi, Pran",,,1977,,
Charandas,,Om Prakash,,,1977,,
Chhailla Babu,,"Rajesh Khanna, Zeenat Aman",,,1977,,
Chor Sipahee,,"Shashi Kapoor, Vinod Khanna, Parveen Babi",,,1977,,
Daku Aur Mahatma,,,,,1977,,
Darling Darling,,"Dev Anand, Zeenat Aman",,,1977,,
Dharam Veer,Manmohan Desai,"Dharmendra, Jeetendra, Zeenat Aman, Neetu Singh, Pran, Jeevan, Ranjeet",Drama,,1977,,
Dhoop Chhaon,,,,,1977,,
Dildaar,,"Jeetendra, Rekha",,,1977,,
Do Chehere,,,,,1977,,
Do Sholay,,Dharmendra,,,1977,,
Doosra Aadmi,Ramesh Talwar,"Rishi Kapoor, Neetu Singh, Raakhee Gulzhar, Shashi Kapoor","Romantic, Drama",,1977,,
Dream Girl,Pramod Chakrovorty,"Dharmendra, Hema Malini",,,1977,,
Dulhan Wahi Jo Piya Man Bhaye,,Talluri Rameshwari,,,1977,,
Ek Hi Raasta,,,"Jeetendra, Shabana Azmi",,1977,,
Farishta Ya Qatil,,Pran,,,1977,,
Gayatri Mahima,,,,,1977,,
Gharaonda,Bhimsain Khurana,"Amol Palekar, Zarina Wahab",,,1977,,
Haiwan,,,,,1977,,
Hatyara,,"Pran, Vinod Khanna, Moushumi Chatterjee",,,1977,,
Hira Aur Patthar,,,,,1977,,
Hum Kisise Kum Naheen,Nasir Hussain,"Rishi Kapoor, Tariq Khan, Kaajol, Amjad Khan, Zeenat Aman",Drama,,1977,,
Immaan Dharam,,"Amitabh Bachchan, Shashi Kapoor, Sanjeev Kumar, Rekha",,,1977,,
Inkaar,,"Vinod Khanna, Amjad Khan, Vidya Singh",,,1977,,
Jadu Tona,,Feroz Khan,,,1977,,
Jagriti,,,,,1977,,
Jai Dwarkadheesh,,,,,1977,,
Jallian Wala Bagh,,Vinod Khanna,,,1977,,
Janam Janam Na Saath,,,,,1977,,
Jay Vejay,,"Jeetendra, Prem Kishan, Reena Roy",,,1977,,
Jeevan Mukt,Sudhendu Roy,"Girish Karnad, Laxmi, Parikshat Sahni, Vidya Sinha, Suresh Oberoi","Family, Drama",,1977,,
Kachcha Chor,,,,,1977,,
Kalabaaz,,Dev Anand,,,1977,,
Kali Raat,,,,,1977,,
Karm,B.R. Chopra,"Rajesh Khanna, Vidya Sinha",,,1977,,
Kasum Khoon Ki,,,,,1977,,
Khel Khilari Ka,Arjun Hingorani,"Dharmendra, Shabana Azmi, Dev Kumar",,,1977,,
Khoon Pasina,Rakesh Kumar,"Amitabh Bachchan, Vinod Khanna, Rekha",,,1977,,
Kinara,Gulzar,"Jeetendra, Dharmendra, Hema Malini",,,1977,,
Kissa Kursi Ka,,,,,1977,,
Kitaab,Gulzar,"Master Raju, Uttam Kumar",,,1977,,
Kotwal Saab,,"Shatrughan Sinha, Arpana Sen",,,1977,,
Ladki Jawan Ho Gayi,,,,,1977,,
Maha Badmaash,,Rajesh Khanna,,,1977,,
Mama Bhanja,,,,,1977,,
Mastan Dada,,,,,1977,,
Meethi Meethi Baatein,,,,,1977,,
Mera Vachan Geeta Ki Kasam,,,,,1977,,
Mit Jayenge Mitane Wale,,Dharmendra,,,1977,,
Mukti,,"Shashi Kapoor, Vidya Sinha, Sanjeev Kumar, Mithun Chakraborty",,,1977,,
Naami Chor,,,,,1977,,
Ooparwala Jaane,,,,,1977,,
Paapi,O.P Ralhan,"Sunil Dutt, Sanjeev Kumar, Reena Roy, Zeenat Aman, Danny, O. P. Ralhan",,,1977,,
Paheli,,,,,1977,,
Palkon Ki Chhaon Mein,,,,,1977,,
Pandit Aur Pathan,Joginder,,,,1977,,
Parvarish,Manmohan Desai,"Shammi Kapoor, Amitabh Bachchan, Vinod Khanna, Shabana Azmi, Neetu Singh, Amjad Khan, Kader Khan, Tom Alter",Drama,,1977,,
Phir Janam Lenge Hum,,,,,1977,,
Pratima Aur Paayal,,,,,1977,,
Prayashchit,,,,,1977,,
Priyatama,Basu Chaterjee,"Jeetendra, Neetu Singh",,,1977,,
Ram Bharose,,Randhir Kapoor,,,1977,,
Safed Jhoot,,"Vinod Mehra, Moushumi Chatterjee",,,1977,,
Saheb Bahadur,Chetan Anand,,,,1977,,
Shankar Hussain,,Kanwaljit Singh,,,1977,,
Shatranj Ke Khiladi,Satyajit Ray,"Sanjeev Kumar, Shabana Azmi, Farida Jalal",Drama,,1977,,
Shirdi Ke Sai Baba,,,,,1977,,
Shri Ram Vanvas,,,,,1977,,
Swami,,"Girish Karnad, Shabana Azmi",,,1977,,
Thief of Baghdad,Ravikant Nagaich,"Shatrughan Sinha, Sulakshana Pandit, Kabir Bedi, Prem Chopra, Mehmood, Premnath",,,1977,,
Tinku,,Rajesh Khanna,,,1977,,
Tyaag,,Rajesh Khanna,,,1977,,
Vishwasghaat,,Sanjeev Kumar,,,1977,,
Yaaron Ka Yaar,,,,,1977,,
Yehi Hai Zindagi,,"Sanjeev Kumar, Lucky Ali",,,1977,,
Zamaanat,,"Jeetendra, Reena Roy, Amjad Khan",,,1977,,
Zehreeli,,,,,1977,,
Aahuti,Ashok V. Bhushan,"Rajendra Kumar, Shashi Kapoor, Rakesh Roshan, Parveen Babi, Zaheera",Drama,,1978,,
Aakhri Daku,Prakash Mehra,"Randhir Kapoor, Vinod Khanna, Rekha, Reena Roy, Sujit Kumar",Action,,1978,,
Amar Shakti,Harmesh Malhotra,"Shashi Kapoor, Shatrughan Sinha",,,1978,,
Anjane Mein,Samir Ganguly,"Rishi Kapoor, Neetu Singh, Sachdev, Jagdeep","Family, Drama",,1978,,
Ankhiyon Ke Jharokhon Se,Hiren Nag,"Sachin, Ranjeeta Kaur, Madan Puri, Iftekhar, Urmila Bhatt",,,1978,,
Apna Khoon,Babbar Subhash,"Shashi Kapoor, Hema Malini, Ashok Kumar, Pran, Amjad Khan","Action, Comedy",,1978,,
Arvind Desai Ki Ajeeb Dastaan,Saeed Akhtar Mirza,"Sulabha Deshpande, Dilip Dhawan, Om Puri, Shriram Lagoo, Anjali Paigankar",,,1978,,
Atithee,Aravind Sen,"Shashi Kapoor, Shabana Azmi, Shatrughan Sinha, Vidya Sinha, Utpal Dutt","Romantic, Drama",,1978,,
Azaad,Pramod Chakratordy,"Dharmendra, Hema Malini, Prem Chopra, Ajit Khan","Action, Thriller",,1978,,
Badalte Rishtey,R. Jhalani,"Rishi Kapoor, Jeetendra, Reena Roy",,,1978,,
Besharam,,"Amitabh Bachchan, Deven Verma, Sharmila Tagore, Amjad Khan",,,1978,,
Bhola Bhala,,"Rajesh khanna, Moushmi Chaterjee",,,1978,,
Chakravyuha,,"Rajesh Khanna, Neetu Singh",,,1978,,
Chor Ho To Aisa,,Pran,,,1978,,
Chor Ke Ghar Chor,Vijay Sadanah,"Zeenat Aman, Randhir Kapoor, Ashok Kumar, Deven Verma, Pran",,,1978,,
College Girl,,"Sachin, Bindiya Goshwami",,,1978,,
Daaku Aur Jawan,Sunil Dutt,"Sunil Dutt, Vinod Khanna, Reena Roy, Ranjeet",,,1978,,
Damaad,,,,,1978,,
Des Pardes,Dev Anand,"Dev Anand, Tina Munim, Pran, Ajit Khan, Amjad Khan, Prem Chopra, Mehmood, Bindiya",,,1978,,
Devata,,"Sanjeev Kumar, Shabana Azmi",,,1978,,
Dil Se Mile Dil,,,,,1978,,
Dillagi,,"Dharmendra, Hema Malini",,,1978,,
Do Musafir,,"Shashi Kapoor, Rekha, Pran",,,1978,,
Don,Chandra Barot,"Amitabh Bachchan, Zeenat Aman, Pran, Yusuf Khan, Mac Mohan",Action,,1978,,
Dr. Iqbal,,,,,1978,,
Ek Baap Chhe Bete,,,,,1978,,
Gaman,Mujafar Ali,"Faruq Shaikh, Smita Patil",,,1978,,
Ganga Ki Saugandh,Sultan Ahmad,"Amitabh Bachchan, Rekha, Pran",,,1978,,
Ghar,,"Vinod Mehra, Rekha",,,1978,,
Heeralaal Pannalaal,,"Shashi Kapoor, Randhir Kapoor, Neetu Singh, Zeenat Aman",,,1978,,
Hullabaloo Over Georgie and Bonnie's Pictures,James Ivory,"Victor Banerjee, Aparna Sen",Comedy,,1978,,
Howrah Bridge Pe Latakti Hui Lash,,,Adult Comedy,,1978,,
Karmayogi,,"Raaj Kumar, Jeetendra, Rekha",,,1978,,
Kasme Vaade,Ramesh Behl,"Amitabh Bachchan, Raakhee Gulzhar, Randhir Kapoor, Neetu Singh, Amjad Khan",Action,,1978,,
Khatta Meetha,Basu Chatterjee,"Rakesh Roshan, Bindiya Goshwami, Ashok Kumar, Perl Padamse",,,1978,,
Khoon Ka Badla Khoon,,Vinod khanna,,,1978,,
Khoon Ki Pukaar,,"Vinod Khanna, Pran",,,1978,,
Kondura,,,,,1978,,
Main Tulsi Tere Aangan Ki,Raj Khosla,"Nutan, Vinod Khanna, Asha Parekh",Drama,,1978,,
Mera Rakshak,,"Mithun Chakraborty, Talluri Rameshwari",,,1978,,
Muqaddar Ka Sikandar,Prakash Mehra,"Amitabh Bachchan, Vinod Khanna, Raakhee Gulzhar, Rekha, Amjad Khan, Ranjeet, Yusuf Khan",Drama,,1978,,
Nasbandi,,I. S. Johar,,,1978,,
Naya Daur,,,,,1978,,
Phaansi,,"Shashi Kapoor, Pran, Sulakshana Pandit",,,1978,,
Phandebaaz,,"Dharmendra, Moushumi Chatterjee, Prem Chopra",,,1978,,
Phool Khile Hain Gulshan Gulshan,Sikandar Khanna,"Moushumi Chatterjee, Rishi Kapoor",,,1978,,
Raja Rani Ko Chahiye Pasina,,,,,1978,,
Ram Kasam,,"Sunil Dutt, Rekha, Bindiya Goshwami",,,1978,,
Saajan Bina Suhagan,Sawan Kumar,"Rajendra Kumar, Nutan, Vinod Mehra, Padmini kolhapuri",,,1978,,
Safed Haathi,Tapan Sinha,Shatrughan Sinha,,,1978,,
Satyam Shivam Sundaram,Raj Kapoor,"Shashi Kapoor, Zeenat Aman",Romance,,1978,,
Shalimar,Krishna Shah,"Dharmendra, Zeenat Aman, Shammi Kapoor",Drama,,1978,,
Sone Ka Dil Lohe Ke Haath,,Rajendra Kumar,,,1978,,
Swarg Narak,Dasari Narayana Rao,"Sanjeev Kumar, Jeetendra, Vinod Mehra, Shabana Azmi, Tanuja, Moushumi Chatterjee",Drama,,1978,,
Toote Khilone,,,,,1978,,
Trishna,,"Shashi Kapoor, Sanjeev Kumar, Rakhee Gulzar",,,1978,,
Tumhare Liye,,"Vidya Sinha, Sanjeev Kumar",,,1978,,
Vishwanath,Subhash Ghai,"Shatrughan Sinha, Reena Roy, Pran",,,1978,,
Aaj Ki Dhara,Mukul Dutt,"Danny Denzongpa, Waheeda Rehman, Rehana Sultan",Drama,,1979,,
Aakhri Kasam,Dinesh-Ramanesh,"Kabir Bedi, Om Shivpuri, Vinod Mehra, Yogeeta Bali",,,1979,,
Aangan Ki Kali,Harsh Kohli,"Geeta Khanna, Lakshmi Narayan, Prema Narayan, Rakesh Roshan",,,1979,,
Aatish,Ambrish Sangal,"Mumtaz Begum, Brahm Bhardwaj, Birbal, Leena Das, Jeetendra",,,1979,,
Ahinsa,Chand,"Sunil Dutt, Rekha, Ranjeet, Rajendra Nath",Action,,1979,,
Ahsaas,Surinder Suri,"Shashi Kapoor, Simi Garewal, Amjad Khan, Bindu, Simple Kapadia, Shammi Kapoor",,,1979,,
Aladdin and the Wonderful Lamp,I.V. Sasi,"Kamal Hassan, Rajnikanth, Srividya",,,1979,,
Amar Deep,"R. Krishnamurthy, K. Vijayan","Rajesh Khanna, Vinod Mehra","Romantic, Drama",,1979,,
Atmaram,Sohanlal Kanwar,"Farida Jalal, Bindiya Goswami, Aruna Irani, Amjad Khan, Pran",Family,,1979,,
Aur Kaun?,"Shyam Ramsay, Tulsi Ramsay","Roopesh Kumar, Madan Puri, Sachin, Om Shivpuri",Horror,,1979,,
Bagula Bhagat,,,,,1979,,
Baton Baton Mein,Basu Chatterjee,"Amol Palekar, Tina Munim, Asrani, Pearl Padamsee, Tun Tun, Mazhar Khan",Comedy,,1979,,
Bhayaanak,S. U. Saiyed,Mithun Chakraborty,Horror,,1979,,
Bin Phere Hum Tere,Rajat Rakshit,"Asha Parekh, Vinod Mehra, Sarika, Nazneen, Kamal Kapoor",Drama,,1979,,
Bombay by Nite,A. Shamsheer,"Ramesh Deo, Prithviraj Kapoor, Sanjeev Kumar",,,1979,,
Chambal Ki Raani,Radhakant,"Mahendra Sandhu, Dara Singh, Chand Usmani, Amjad Khan","Crime, Action",,1979,,
Cinema Cinema,Krishna Shah,"Amitabh Bachchan, Zeenat Aman, Dharmendra, Hema Malini",Documentary,,1979,,
Dada,Jugal Kishore,"Vinod Mehra, Bindiya Goswami, Jeevan, Amjad Khan","Action, Drama, Family",,1979,,
Dhongee,,Randhir Kapoor,,,1979,,
Dil Kaa Heera,,"Dharmendra, Hema Malini",Action Thriller,,1979,,
Do Ladke Dono Kadke,Basu Chatterjee,"Amol Palekar, Asrani, Moushumi Chatterjee",Comedy,,1979,,
Do Shikaari,Kuljit Pal,"Vinod Khanna, Biswajeet, Rekha, Amjad Khan",Action,,1979,,
Dooriyaan,Bhimsain,"Uttam Kumar, Sharmila Tagore, Shreeram Lagoo",Drama,,1979,,
Duniya Meri Jeb Mein,,"Shashi Kapoor, Rishi Kapoor, Neetu Singh, Ranjeet",,,1979,,
Ganga Bhavani,T. Prakash Rao,Gummadi,Drama,,1979,,
Gautam Govinda,,"Shashi Kapoor, Shatrughan Sinha, Nirupa Roy",,,1979,,
Ghar Ki Laaj,B. R. Ishara,"Sanjeev Kumar, Moushumi Chatterjee",Drama,,1979,,
