Title,Director,Cast,Genre,Sources,Year,Sources / notes,sources
Aag Aur Daag,A. Salaam,"Joy Mukherjee, Madan Puri",Action,1,1970,,
Aan Milo Sajna,Mukul Dutt,"Asha Parekh, Rajesh Khanna, Vinod Khanna",Drama,2,1970,,
Aansoo Aur Muskan,P. Madhavan,"Bindu, Padmini",Drama,3,1970,,
Abhinetri,Subodh Mukherjee,"Shashi Kapoor, Hema Malini, Deb Mukherjee",Drama,4,1970,,
Bachpan,Kotayya Pratyagatma,"Sanjeev Kumar, Tanuja",Drama,5,1970,,
Bhagwan Parshuram,Babubhai Mistri,"Abhi Bhattacharya, Jayshree Gadkar",Drama,6,1970,,
Bhai-Bhai,Raja Nawathe,"Sunil Dutt, Asha Parekh, Mumtaz, Pran",Drama,7,1970,,
Bombay Talkie,James Ivory,"Shashi Kapoor, Jennifer Kendal",,8,1970,,
Chetna,B.R. Ishara,"Shatrughan Sinha, Anil Dhawan",Action,9,1970,,
Choron Ka Chor,Mohammed Hussain,Madan Puri,Drama,10,1970,,
Darpan,Adurthi Subba Rao,"Sunil Dutt, Waheeda Rehman",Drama,11,1970,,
Dastak,Rajinder Singh Bedi,Sanjeev Kumar,Drama,12,1970,,
Deedar,Jugal Kishore,"Dheeraj Kumar, Anjana Choudhury",Drama,13,1970,,
Devi,Madhusudan Rao V.,"Nutan, Sanjeev Kumar, Madan Puri",Drama,14,1970,,
Dharti,Sridhar,"Rajendra Kumar, Waheeda Rehman",Action,15,1970,,
Ehsan,Shiv Kumar,"Helen, Aruna Irani",Drama,16,1970,,
Ek Nanhi Munni Ladki Thi,Vishram Bedekar,"Prithviraj Kapoor, Mumtaz, Helen",Drama,17,1970,,
Ganwaar,Naresh Kumar,"Vyjayanthimala, Rajendra Kumar, Pran",Romance,18,1970,,
Geet,Ramanand Sagar,"Rajendra Kumar, Mala Sinha, Sujeet Kumar",Drama,19,1970,,
Ghar Ghar Ki Kahani,T. Prakash Rao,"Balraj Sahani, Nirupa Roy, Rakesh Roshan, Bharathi Vishnuvardhan",Drama,20,1970,,
Gopi,A. Bhimsingh,"Dilip Kumar, Saira Banu, Om Prakash, Pran",,21,1970,,
Gunah Aur Kanoon,B.R. Ishara,"Sanjeev Kumar, Prithviraj Kapoor",Drama,22,1970,,
Heer Raanjha,Chetan Anand,"Prithviraj Kapoor, Raaj Kumar, Pran",Romance,23,1970,,
Himmat,Ravikant Nagaich,"Jeetendra, Mumtaz, Prem Chopra",Romance,24,1970,,
Holi Ayee Re,Harsukh Jagneshwar Bhatt,"Shatrughan Sinha, Mala Sinha",Romance,25,1970,,
Humjoli,Ramanna,"Jeetendra, Leena Chandavarkar, Pran",Comedy,26,1970,,
Insaan Aur Shaitan,Aspi Irani,"Sanjeev Kumar, Aruna Irani",Action,27,1970,,
Inspector,Chand,"Helen, Joy Mukherjee",Action,28,1970,,
Ishq Par Zor Nahin,Ramesh Saigal,"Dharmendra, Sadhana Shivdasani",Romance,29,1970,,
Jawab,Ramaana,"Mehmood Ali, Aruna Irani, Prem Chopra",Romance,30,1970,,
Jeevan Mrityu,Satyen Bose,"Dharmendra, Raakhee",Romance,31,1970,,
Johny Mera Naam,Vijay Anand,"Dev Anand, Hema Malini, Pran, Prem Nath",Crime Drama,32,1970,,
Kab? Kyoon? Aur Kahan?,Anil Hingorani,"Dharmendra, Babita, Pran",Mystery,33,1970,,
Khilona,Chander Vohra,"Jeetendra, Mumtaz, Sanjeev Kumar",Romance,34,1970,,
Maa Aur Mamta,Asit Sen,"Nutan, Ashok Kumar",Drama,35,1970,,
Maa Ka Aanchal,Jagdev Bhambri,"Sanjeev Kumar, Leela Mishra",Drama,36,1970,,
Maharaja,Naresh Saigal,"Sanjay Khan, Nutan, Nirupa Roy",Drama,37,1970,,
Man Ki Aankhen,Raghunath Jhalani,"Dharmendra, Waheeda Rehman",Drama,38,1970,,
Mastana,Adurthi Subba Rao,"Mehmood, Vinod Khanna, Bharathi Vishnuvardhan",Comedy,39,1970,,
Mera Naam Joker,Raj Kapoor,"Raj Kapoor, Rajendra Kumar, Manoj Kumar, Dharmendra, Simi Garewal, Rishi Kapoor","Drama, Musical",40,1970,,
Mere Humsafar,Dulal Guha,"Jeetendra, Sharmila Tagore",Romance,41,1970,,
Moojrim,Kewal Misra,"Joy Mukherjee, Kumud Chuggani",Action,42,1970,,
My Love,S. Sukhdev,"Shashi Kapoor, Sharmila Tagore",Romance,43,1970,,
Nanak Dukhiya Sab Sansar,Dara Singh,"Dara Singh, Balraj Sahni, Prithviraj Kapoor, Pran, Mumtaz",,44,1970,,
Naya Raasta,Khalid Akhtar,"Jeetendra, Asha Parekh, Farida Jalal",Drama,45,1970,,
Pagla Kahin Ka,Shakti Samanta,"Shammi Kapoor, Asha Parekh",Romance,46,1970,,
Pardesi,Kundan Kumar,Mumtaz,Drama,47,1970,,
Pavitra Paapi,Rajendra Bhatia,"Balraj Sahni, Tanuja",Drama,48,1970,,
Pehchan,Sohanlal Kanwar,"Manoj Kumar, Babita",Romance,49,1970,,
Prem Pujari,Dev Anand,"Dev Anand, Waheeda Rehman, Shatrughan Sinha",Romance,50,1970,,
Purab Aur Paschim,Manoj Kumar,"Manoj Kumar, Saira Banu, Bharathi Vishnuvardhan, Madan Puri, Pran, Prem Chopra",Drama,51,1970,,
Puraskar,,"Joy Mukherjee, Farida Jalal",Action,52,1970,,
Pushpanjali,Kishore Sahu,"Sanjay Khan, Prem Nath",Drama,53,1970,,
Raaton Ka Raja,,"Dheeraj Kumar, Shatrughan Sinha",Drama,54,1970,,
Rootha Na Karo,Sunder Dar,"Shashi Kapoor, Aruna Irani, Nanda",Romance,55,1970,,
Saas Bhi Kabhi Bahu Thi,,"Sanjay Khan, Leena Chandavarkar",Drama,56,1970,,
Sachaa Jhutha,Manmohan Desai,"Rajesh Khanna, Mumtaz, Vinod Khanna",Drama,57,1970,,
Safar,Asit Sen,"Sharmila Tagore, Ashok Kumar, Rajesh Khanna, Feroz Khan",Drama,58,1970,,
Samaj Ko Badal Dalo,Madhusudan Rao V.,"Aruna Irani, Sharada, Pran",Drama,59,1970,,
Sampoorna Teerth Yatra,Dhirubhai Desai,"Jaymala, Jeevan",Drama,60,1970,,
Sawan Bhadon,Mohan Segal,"Rekha, Navin Nischol",Drama,61,1970,,
Sharafat,Asit Sen,"Ashok Kumar, Dharmendra, Hema Malini",,62,1970,,
Soldier Thakur Daler Singh,Shyam,"Ajit Singh Deol, Dharmendra, Deepa, Om Prakash, Kumar Ajit, Mehmood",,63,1970,,
Suhana Safar,Vijay,"Shashi Kapoor, Sharmila Tagore",Drama,64,1970,,
The Train,Ravikant Nagaich,"Rajesh Khanna, Nanda, Helen, Madan Puri",Drama,65,1970,,
Truck Driver,,,,66,1970,,
Tum Haseen Main Jawaan,Bhappi Sonie,"Dharmendra, Hema Malini, Helen, Pran",Romance,67,1970,,
Umang,Atma Ram,"Subhash Ghai, Satish Kumar",Drama,68,1970,,
Yaadgaar,S. Ram Sharma,"Nutan, Manoj Kumar, Prem Chopra, Madan Puri, Pran",Drama,69,1970,,
Aap Aye Bahaar Ayee,Mohan Kumar,"Rajendra Kumar, Sadhna, Prem Chopra",Comedy,,1971,,
Adhikar,S.M. Sagar,"Ashok Kumar, Nanda, Deb Mukherjee, Pran",Drama,,1971,,
Albela,A. Shamsheer,"Mehmood Ali, Aruna Irani",Drama,,1971,,
Anand,Hrishikesh Mukherjee,"Rajesh Khanna, Amitabh Bachchan, Ramesh Deo, Sumita Sanyal",Drama,,1971,,
Andaz,Ramesh Sippy,"Shammi Kapoor, Hema Malini, Rajesh Khanna",Drama,,1971,,
Anubhav,Basu Bhattacharya,"Tanuja, Sanjeev Kumar",Drama,,1971,,
Badnam Basti,Prem Kapoor,"Nitin Sethi, Nadita Thakur",Drama,,1971,,
Badnam Farishte,,Sharmila Tagore,Drama,,1971,,
Balidaan,,"Saira Banu, Manoj Kumar",Drama,,1971,,
Banphool,Vijay Bhatt,"Jeetendra, Babita, Shatrughan Sinha",Romance,,1971,,
Beharoopia,Rajesh Nanda,Helen,Drama,,1971,,
Bikhare Moti,Tapi Chanakya,"Jeetendra, Babita",Romance,,1971,,
Buddha Mil Gaya,Hrishikesh Mukherjee,"Navin Nischol, Om Prakash, Archana",Drama,,1971,,
Caravan,Nasir Hussain,"Jeetendra, Asha Parekh, Aruna Irani",Romance,,1971,,
Chaahat,Homi Bhattacharya,"Jeetendra, Mumtaz, Mala Sinha",Romance,,1971,,
Chhoti Bahu,K.B. Tilak,"Rajesh Khanna, Sharmila Tagore",Drama,,1971,,
Do Boond Pani,Khwaja Ahmad Abbas,"Simi Garewal, Madhu Chanda, Jalal Agha",Drama,,1971,,
Do Raha,,"Shatrughan Sinha, Anil Dhawan",Drama,,1971,,
Door Ka Raahi,Kishore Kumar,"Tanuja, Kishore Kumar, Ashok Kumar",Drama,,1971,,
Dost Aur Dushman,Kewal Mishra,"Shatrughan Sinha, Rekha, Vinod Khanna",Drama,,1971,,
Ek Nari Ek Brahmachari,Kotayya Pratyagatma,"Jeetendra, Mumtaz, Aruna Irani",Comedy,,1971,,
Ek Paheli,Naresh Kumar,"Sanjeev Kumar, Feroz Khan, Aruna Irani",Thriller,,1971,,
Elaan,K. Ramanlal,"Vinod Mehra, Vinod Khanna, Rekha, Madan Puri",Thriller,,1971,,
Ek Thi Reeta,Roop K. Shorey,"Vinod Mehra, Tanuja, I. S. Johar, Rehman, Daisy Irani, Faryal, Lolita Chatterjee",Drama,,1971,,
Gambler,Amarpreet,"Dev Anand, Zaheeda, Shatrughan Sinha, Zaheera",Thriller,,1971,,
Ganga Tera Pani Amrit,,"Nirupa Roy, Narendra Nath, Pran",Drama,,1971,,
Guddi,Hrishikesh Mukherjee,"Dharmendra, Jaya Bhaduri, Pran",Romance,,1971,,
Haathi Mere Saathi,M.A. Thirumugham,"Rajesh Khanna, Tanuja",Romance,,1971,,
Hare Rama Hare Krishna,Dev Anand,"Dev Anand, Zeenat Aman, Mumtaz, Prem Chopra, Rajendra Nath",Drama,,1971,,
Haseenon Ka Devata,Ravikant Nagaich,"Sanjay Khan, Rekha, Helen",Drama,,1971,,
Hulchul,O. P. Ralhan,"Prem Chopra, Kabir Bedi, Zeenat Aman, Helen, Madan Puri",Thriller,,1971,,
Hum Tum Aur Woh,Shiv Kumar,"Vinod Khanna, Bharathi Vishnuvardhan",Drama,,1971,,
Hungama,,"Kishore Kumar, Vinod Khanna, Mumtaz",Comedy,,1971,,
Jaane-Anjaane,Shakti Samanta,"Shammi Kapoor, Vinod Khanna, Leena Chandavarkar",Drama,,1971,,
Jai Bangladesh,I. S. Johar,"Kabari Choudhury, Dilip Dutt",Drama,,1971,,
Jai Jawan Jai Makan,Vishram Bedekar,"Jaya Bhaduri, Anil Dhawan",Drama,,1971,,
Jal Bin Machhli Nritya Bin Bijli,Rajaram Vankudre Shantaram,"Dina Pathak, Abhijeet",Romance,,1971,,
Jawan Mohabbat,Bhappi Sonie,"Shammi Kapoor, Asha Parekh, Mumtaz, Pran",Romance,,1971,,
Johar Mehmood in Hong Kong,S.A. Akbar,"Mehmood Ali, Aruna Irani, Pran",Comedy,,1971,,
Jwala,M.V. Raman,"Sunil Dutt, Madhubala, Pran",Action,,1971,,
Kabhi Dhoop Kabhi Chhaon,Chandrakant,"Dara Singh, Ameeta",Drama,,1971,,
Kahin Aar Kahin Paar,,"Joy Mukherjee, Nadira",Romance,,1971,,
Kal Aaj Aur Kal,Randhir Kapoor,"Prithviraj Kapoor, Raj Kapoor, Randhir Kapoor, Babita",Drama,,1971,,
Kangan,K.B. Tilak,"Aruna Irani, Mala Sinha, Sanjeev Kumar",Drama,,1971,,
Kathputli,Brij,"Jeetendra, Mumtaz",Romance,,1971,,
Kati Patang,Shakti Samanta,"Rajesh Khanna, Asha Parekh",Romance,,1971,,
Khoj,Jugal Kishore,"Farida Jalal, Shatrughan Sinha",Drama,,1971,,
Ladki Pasand Hai,C. L. Rawal,Mumtaz,Drama,,1971,,
Lagan,Ramanna,Prem Chopra,Drama,,1971,,
Lakhon Mein Ek,S. S. Balan,"Aruna Irani, Mehmood Ali, Pran",Comedy,,1971,,
Lal Patthar,Sushil Majumdar,"Raaj Kumar, Hema Malini, Raakhee, Vinod Mehra",Romance,,1971,,
Main Sunder Hoon,R. Krishnan,"Mehmood Ali, Leena Chandavarkar",Drama,,1971,,
Man Mandir,Tapi Chanakya,"Sanjeev Kumar, Waheeda Rehman, Rakesh Roshan",Drama,,1971,,
Man Tera Tan Mera,B. R. Ishara,Rehana Sultan,Drama,,1971,,
Maryada,Aravind Sen,"Rajesh Khanna, Mala Sinha, Pran",Romance,,1971,,
Mehboob Ki Mehndi,Harnam Singh Rawail,"Rajesh Khanna, Leena Chandavarkar",Romance,,1971,,
Mela,Prakash Mehra,"Sanjay Khan, Mumtaz, Feroz Khan",,,1971,,
Memsaab,Atma Ram,"Vinod Khanna, Yogeeta Bali",Drama,,1971,,
Mera Gaon Mera Desh,Raj Khosla,"Asha Parekh, Dharmendra, Vinod Khanna",Drama,,1971,,
Mere Apne,Gulzar,"Meena Kumari, Vinod Khanna, Shatrughan Sinha",Drama,,1971,,
Naya Zamana,Pramod Chakravorty,"Dharmendra, Hema Malini, Ashok Kumar, Pran",Romance,,1971,,
Paras,C. P. Dixit,"Sanjeev Kumar, Shatrughan Sinha, Raakhee",Drama,,1971,,
Paraya Dhan,Rajendra Bhatia,"Hema Malini, Rakesh Roshan, Balraj Sahni",Drama,,1971,,
Parde Ke Peechey,K. Shankar,"Vinod Mehra, Yogeeta Bali, Bindu, Pran",Drama,,1971,,
Parwana,Jyoti Swaroop,"Amitabh Bachchan, Navin Nischol, Yogeeta Bali",,,1971,,
Patanga,Kedar Kapoor,"Shashi Kapoor Vimi, Zeb Rehman",Drama,,1971,,
Phir Bhi,Shivendra Sinha,"Pratap Sharma, Urmila Bhatt, Suresh Oberoi",Drama,,1971,,
Preet Ki Dori,,"Parikshit Sahni, Tanuja",Drama,,1971,,
Preetam,Bhappi Sonie,"Shammi Kapoor, Leena Chandavarkar",Romance,,1971,,
Pyar Ki Kahani,Ravikant Nagaich,"Amitabh Bachchan, Tanuja, Mala Sinha",Drama,,1971,,
Rakhwala,Adurthi Subba Rao,"Dharmendra, Leena Chandavarkar",Romance,,1971,,
Ramu Ustad,Mohammed Hussain,"Madan Puri, Dara Singh",Drama,,1971,,
Reshma Aur Shera,Sunil Dutt,"Sunil Dutt, Waheeda Rehman, Amitabh Bachchan, Vinod Khanna",,,1971,,
Saat Sawal,Babubhai Mistry,Johnny Whisky,Drama,,1971,,
Saaz Aur Sanam,JBH Wadia,"Rekha, Premendra",Romance,,1971,,
Sansar,Dilip Bose,"Anupama, Nirupa Roy",Drama,,1971,,
Seema,Surendra Mohan,"Kabir Bedi, Simi Garewal, Rakesh Roshan, Bharati, Padma Khanna, Abhi Bhattacharya",Drama,,1971,,
Sharmeelee,Samir Ganguly,"Shashi Kapoor, Raakhee",Romance,,1971,,
Shri Krishna Leela,Homi Wadia,"Sachin, Hina, Jayshree Gadkar, Sapru, Manhar Desai, Tabassum",Religious,,1971,,
Tere Mere Sapne,Vijay Anand,"Dev Anand, Vijay Anand, Mumtaz, Hema Malini, Tabassum, Agha",,,1971,,
Tulsi Vivah,Chandrakant,"Abhi Bhattacharya, Dara Singh, Randhawa, Jayshree Gadkar, Anita Guha",Mythology Religious Drama,,1971,,
Ummeed,Nitin Bose,"Ashok Kumar, Joy Mukherjee, Leela Naidu, Nanda, Leela Mishra, Tun Tun",Family Social Drama,,1971,,
Upaasna,Mohan,"Sanjay Khan, Mumtaz, Feroz Khan, Helen, Anwar Hussain",Drama,,1971,,
Uphaar,Sudhendu Roy,"Jaya Badhuri, Swarup Dutt, Kamini Kaushal, Suresh Chatwal, Leela Mishra",Family Drama,,1971,,
Woh Din Yaad Karo,K. Amarnath,"Sanjay Khan, Nanda, Mehmood Ali, Madan Puri, Shashikala, Tun Tun, Wasti, Jayshree T.",Drama,,1971,,
Aan Baan,Prakash Mehra,"Raakhee, Pran",Drama,,1972,,
Aankh Micholi,Ramanna,"Rakesh Roshan, Bharathi Vishnuvardhan, Farida Jalal",Drama,,1972,,
Aankhon Aankhon Mein,Raghunath Jhalani,"Rakesh Roshan, Raakhee, Pran",Drama,,1972,,
Amar Prem,Shakti Samanta,"Rajesh Khanna, Sharmila Tagore",Drama,,1972,,
Annadata,Asit Sen,"Jaya Bhaduri, Anil Dhawan",Drama,,1972,,
Anokha Daan,Asit Sen,"Kabir Bedi, Tarun Bose, Anil Dhawan, Zaheera",Drama,,1972,,
Anokha Milan,Jagannath Chatterjee,"Dilip Kumar, Dharmendra",Drama,,1972,,
Anokhi Pehchan,Satyen Bose,"Sanjay Khan, Raakhee",Drama,,1972,,
Anuraag,Shakti Samanta,"Nutan, Rajesh Khanna",Drama,,1972,,
Apna Desh,Jambu,"Rajesh Khanna, Mumtaz",Drama,,1972,,
Apradh,Feroz Khan,"Feroz Khan, Mumtaz",Action,,1972,,
Babul Ki Galiyaan,S.D. Narang,"Sanjay Khan, Hema Malini, Shatrughan Sinha",Drama,,1972,,
Baharon Phool Barsao,,Dheeraj Kumar,Drama,,1972,,
Bandagi,K. Shankar,Pandharibai,Romance,,1972,,
Bansi Birju,Prakash Verma,"Amitabh Bachchan, Jaya Bhaduri",Romance,,1972,,
Bawarchi,Hrishikesh Mukherjee,"Rajesh Khanna, Jaya Bhaduri",Comedy,,1972,,
Be-Imaan,Sohanlal Kanwar,"Manoj Kumar, Raakhee, Pran",,,1972,,
Bees Saal Pehle,Probir Roy,Lalita Pawar,Drama,,1972,,
Bindiya Aur Bandook,,,,,1972,,
Bhai Ho To Aisa,Manmohan Desai,"Jeetendra, Hema Malini, Shatrughan Sinha",Drama,,1972,,
Bombay to Goa,S. Ramanathan,"Amitabh Bachchan, Shatrughan Sinha, Aruna Irani, Mehmood",Drama,,1972,,
Buniyaad,Virender Sinha,"Rakesh Roshan, Shatrughan Sinha, Yogeeta Bali, Pran",Drama,,1972,,
Dastaan,B.R. Chopra,"Dilip Kumar, Sharmila Tagore, Bindu",Drama,,1972,,
Dharkan,Devendra Goel,"Sanjay Khan, Mumtaz",Thriller,,1972,,
Dil Daulat Duniya,Prem Narayan Arora,"Rajesh Khanna, Sadhana Shivdasani, Ashok Kumar, Helen",Drama,,1972,,
Dil Ka Raja,P. Madhavan,"Waheeda Rehman, Raaj Kumar",Action,,1972,,
Do Bachche Dus Haath,Kalpataru,"Nasir Ahmad Ansari, Prem Nath",Drama,,1972,,
Do Chor,Padmanabh,"Dharmendra, Tanuja",Action,,1972,,
Do Gaz Zameen Ke Neeche,Tulsi Ramsay,Satyendra Kapoor,Horror,,1972,,
Do Yaar,Kewal Misra,"Vinod Khanna, Rekha, Shatrughan Sinha",Action,,1972,,
Double Cross,Gogi Anand,"Vijay Anand, Rekha",Action,,1972,,
Dushman,Dulal Guha,"Rajesh Khanna, Mumtaz",Drama,,1972,,
Ek Adhuri Kahani,Mrinal Sen,"Utpal Dutt, Shekhar Chatterjee",Drama,,1972,,
Ek Bar Mooskura Do,Ram Mukherjee,"Shobhna Samarth, Joy Mukherjee, Tanuja, Deb Mukherjee",Drama,,1972,,
Ek Bechara,S.M. Abbas,"Jeetendra, Rekha, Vinod Khanna, Pran",Drama,,1972,,
Ek Hasina Do Diwane,S.M. Abbas,"Jeetendra, Babita, Vinod Khanna",Romance,,1972,,
Ek Khiladi Bawan Pattey,,"Vinod Khanna, Ravi Khanna",,,1972,,
Ek Nazar,B.R. Ishara,"Amitabh Bachchan, Jaya Bachchan, Nadira",Romance,,1972,,
Gaon Hamara Shaher Tumhara,Naresh Kumar,"Rajendra Kumar, Rekha",Romance,,1972,,
Garam Masala,Aspi Irani,"Aruna Irani, Mehmood Ali",Comedy,,1972,,
Gomti Ke Kinare,Saawan Kumar Tak,"Meena Kumari, Sameer Khan, Mumtaz",Drama,,1972,,
Gora Aur Kala,Naresh Kumar,"Rekha, Rajendra Kumar, Hema Malini",Action,,1972,,
Grahan,Arvind Kumar Sinha,Nutan,Drama,,1972,,
Haar Jeet,C.P. Dixit,"Rehana Sultan, Anil Dhawan",Drama,,1972,,
Hari Darshan,Chandrakant,"Dara Singh, B. Saroja Devi",Fantasy,,1972,,
Jai Jwala,Manohar Deepak,Sunil Dutt,Drama,,1972,,
Jangal Mein Mangal,Rajendra Bhatia,"Kiran Kumar, Reena Roy, Pran",Romance,,1972,,
Janwar Aur Insaan,Tapi Chanakya,"Shashi Kapoor, Raakhee",Drama,,1972,,
Jawani Diwani,Narendra Bedi,"Randhir Kapoor, Jaya Bhaduri",Romance,,1972,,
Jeet,Adurthi Subba Rao,"Randhir Kapoor, Babita",Romance,,1972,,
Joroo Ka Ghulam,A. Bhimsingh,"Rajesh Khanna, Nanda, Om Prakash",Comedy,,1972,,
Koshish,Sampooran Singh Gulzar,"Sanjeev Kumar, Jaya Bhaduri",,,1972,,
Lalkaar,Ramanand Sagar,"Dharmendra, Rajendra Kumar, Mala Sinha, Kum Kum",Action,,1972,,
Maalik,A. Bhimsingh,"Rajesh Khanna, Sharmila Tagore",Drama,,1972,,
Man Jaiye,B.R. Ishara,Rakesh Pandhya,Drama,,1972,,
Maya Darpan,Kumar Shahani,"Aditi, Anil Pandya",Drama,,1972,,
Mere Bhaiya,Satyen Bose,"Vijay Arora, Suresh Chatwal",Drama,,1972,,
Midnight,Raju,,Romance,,1972,,
Milap,B.R. Ishara,"Shatrughan Sinha, Danny Denzongpa",Action,,1972,,
Mere Jeevan Saathi,Ravi Nagaish,"Rajesh Khanna, Tanuja",Romance,,1972,,
Mome Ki Gudiya,Mohan Kumar,"Ratan Chopra, Tanuja",Drama,,1972,,
Pakeezah,Kamal Amrohi,"Raaj Kumar, Meena Kumari, Ashok Kumar",Drama,,1972,,
Parchhaiyan,Sharankumar Chand,"Vinod Khanna, Bindu",Drama,,1972,,
Parichay,Sampooran Singh Gulzar,"Jeetendra, Jaya Bhaduri, Pran",,,1972,,
Piya Ka Ghar,Basu Chatterjee,"Anil Dhawan, Jaya Badhuri",Drama,,1972,,
Pyaar Diwana,Samar Chatterjee,"Kishore Kumar, Mumtaz",Comedy,,1972,,
Raampur Ka Lakshman,Manmohan Desai,"Randhir Kapoor, Shatrughan Sinha, Rekha",Drama,,1972,,
Raaste Kaa Patthar,Mukul Dutt,"Amitabh Bachchan, Shatrughan Sinha",Action,,1972,,
Raja Jani,Mohan Segal,"Dharmendra, Hema Malini, Prem Nath",Drama,,1972,,
Rakhi Aur Hathkadi,S.M. Sagar,"Ashok Kumar, Asha Parekh",Action,,1972,,
Rani Mera Naam,S.M. Sagar,"Ashok Kumar, Prem Nath",Drama,,1972,,
Rivaaj,T. Prakash Rao,"Farida Jalal, Mala Sinha",Drama,,1972,,
Roop Tera Mastana,Khalid Akhtar,"Jeetendra, Mumtaz, Pran",Romance,,1972,,
Sa-Re-Ga-Ma-Pa,Satyen Bose,Ashok Kumar,Drama,,1972,,
Sabse Bada Sukh,Hrishikesh Mukherjee,"Vijay Arora, Utpal Dutt",Drama,,1972,,
Samaanta,Nitin Bose,Dheeraj Kumar,Drama,,1972,,
Samadhi,Prakash Mehra,"Dharmendra, Jaya Badhuri, Asha Parekh",Romance,,1972,,
Sanjog,S.S. Balan,"Amitabh Bachchan, Mala Sinha",Comedy,,1972,,
Sazaa,Chand,"Kabir Bedi, Rekha, Jeetendra, Ashok Kumar, Yogeeta Bali, Pran",Thriller,,1972,,
Seeta Aur Geeta,Ramesh Sippy,"Dharmendra, Sanjeev Kumar, Hema Malini",Romance,,1972,,
Shaadi Ke Baad,L.V. Prasad,"Jeetendra, Shatrughan Sinha, Raakhee",Drama,,1972,,
Shararat,Manmohan Desai,"Mumtaz, Shatrughan Sinha",Drama,,1972,,
Shayar-e-Kashmir Mahjoor,Prabhat Mukherjee,Balraj Sahni,Drama,,1972,,
Shehzada,K. Shankar,"Rajesh Khanna, Raakhee",Drama,,1972,,
Shor,Manoj Kumar,"Manoj Kumar, Nanda, Jaya Bachchan",Drama,,1972,,
Sub Ka Saathi,A. Bhimsingh,"Vinod Khanna, Bharthi",Drama,,1972,,
Subah-o-Shyam,Tapi Chanakya,"Sanjeev Kumar, Waheeda Rehman",Drama,,1972,,
Sultana Daku,Mohammed Hussain,"Helen, Dara Singh",Drama,,1972,,
Tangewala,Naresh Kumar,"Mumtaz, Sujit Kumar",Action,,1972,,
Tanhai,Naresh Kumar,Rehana Sultan,Drama,,1972,,
Trisandhya,Raj Marbros,Waheeda Rehman,Drama,,1972,,
Victoria No. 203,Brij,"Navin Nischol, Saira Banu, Ashok Kumar, Pran",Drama,,1972,,
Wafaa,Ramanna,"Raakhee, Nasir Hussain, Sanjay Khan",Drama,,1972,,
Yeh Gulistan Hamara,Atma Ra,"Dev Anand, Sharmila Tagore, Pran",Drama,,1972,,
Zameen Aasmaan,A. Veerappan,"Sunil Dutt, Yogeeta Bali",Action,,1972,,
Zaroorat,B.R. Ishara,"Reena Roy, Danny Denzongpa",Drama,,1972,,
Zindagi Zindagi,Tapan Sinha,"Deb Mukherjee, Waheeda Rehman, Farida Jalal, Ashok Kumar",Romance,,1972,,
Aa Gale Lag Jaa,Manmohan Desai,"Shashi Kapoor, Sharmila Tagore, Shatrughan Sinha",Romance,,1973,,
Aaj Ki Taaza Khabar,Rajendra Bhatia,"Radha Saluja, Kiran Kumar",Action,,1973,,
Aangan,Nasir Hussain,,Drama,,1973,,
Abhimaan,Hrishikesh Mukherjee,"Amitabh Bachchan, Jaya Badhuri, Bindu",Drama,,1973,,
Achanak,Gulzar,"Vinod Khanna, Farida Jalal",Crime,,1973,,
Agni Rekha,Mahesh Kaul,"Bindu, Sanjeev Kumar",Drama,,1973,,
Anamika,Raghunath Jhalani,"Sanjeev Kumar, Jaya Badhuri",Drama,,1973,,
Anhonee,Ravi Tandon,"Sanjeev Kumar, Leena Chandavarkar, Kamini Kaushal, Bindu",Drama,,1973,,
Anokhi Ada,Kundan Kumar,"Jeetendra, Rekha, Vinod Khanna",Romance,,1973,,
Bada Kabutar,Deven Verma,"Rehana Sultan, Amitabh Bachchan, Helen",Comedy,,1973,,
Banarasi Babu,Shankar Mukherjee,"Dev Anand, Raakhee, Yogeeta Bali",Drama,,1973,,
Bandhe Haath,O. P. Ralhan,"Amitabh Bachchan, Mumtaz",Action,,1973,,
Barkha Bahar,Amar Kumar,"Navin Nischol, Rekha",Romance,,1973,,
Black Mail,Vijay Anand,"Dharmendra, Raakhee, Madan Puri, Shatrughan Sinha",Thriller,,1973,,
Bobby,Raj Kapoor,"Rishi Kapoor, Dimple Kapadia, Pran",Romance,,1973,,
Chhalia,Mukul Dutt,"Navin Nischol, Nanda, Shatrughan Sinha",Action,,1973,,
Chhupa Rustam,Vijay Anand,"Dev Anand, Hema Malini, Vijay Anand",Action,,1973,,
Daag: A Poem of Love,Yash Chopra,"Rajesh Khanna, Sharmila Tagore, Raakhee",Romance,,1973,,
Daaman Aur Aag,,"Sanjay Khan, Saira Banu",,,1973,,
Dhamkee,Kalpataru,"Subhash Ghai, Vinod Khanna",Thriller,,1973,,
Dharma,Chand,"Navin Nischol, Rekha, Pran, Ajit Khan, Prem Chopra",Action,,1973,,
Dhund,B.R. Chopra,"Sanjay Khan, Zeenat Aman, Danny Denzongpa",Thriller,,1973,,
Dil Ki Rahen,B. R. Ishara,"Rakesh Pandey, Rehana Sultan",Drama,,1973,,
Do Phool,S. Ramanathan,"Vinod Mehra, Aruna Irani, Mehmood Ali",Comedy,,1973,,
Door Nahin Manzil,,"Pradeep Kumar, Sanjeev Kumar",,,1973,,
Duvidha,Mani Kaul,"Ravi Menon, Raisa Padamsee",Drama,,1973,,
Ek Kunwari Ek Kunwara,Prakash Mehra,"Rakesh Roshan, Leena Chandavarkar, Pran",Drama,,1973,,
Ek Mutthi Aasmaan,Virender Sinha,"Vijay Arora, Yogeeta Bali, Pran",Drama,,1973,,
Ek Nari Do Roop,,"Nadira, Shatrughan Sinha",Drama,,1973,,
Gaai Aur Gori,M. A. Thirumugam,"Jaya Bhaduri, Shatrughan Sinha",Drama,,1973,,
Ghaddaar,Harmesh Malhotra,"Yogeeta Bali, Vinod Khanna, Pran",Drama,,1973,,
Garam Hawa,M. S. Sathyu,"Balraj Sahni, Shaukat Azmi",Drama,,1973,,
Gehri Chaal,C.V. Sridhar,"Jeetendra, Hema Malini, Amitabh Bachchan",Thriller,,1973,,
Ghulam Begam Badshah,Jambu,"Shatrughan Sinha, Anil Dhawan, Moushumi Chatterjee",Drama,,1973,,
Haathi Ke Daant,B. R. Ishara,Rakesh Pandey,Drama,,1973,,
Hanste Zakhm,Chetan Anand,"Navin Nischol, Priya Rajvansh, Balraj Sahni",Romance,,1973,,
Heera,Sultan Ahmed,"Sunil Dutt, Asha Parekh",Action,,1973,,
Heera Panna,Dev Anand,"Dev Anand, Raakhee, Zeenat Aman",Romance,,1973,,
Hifazat,K.S.R. Das,"Vinod Mehra, Asha Sachdev, Ashok Kumar, Lalita Pawar",Drama,,1973,,
Hindustan Ki Kasam,Chetan Anand,"Raaj Kumar, Priya Rajvansh, Amjad Khan, Amrish Puri",Action,,1973,,
Honeymoon,Hiren Nag,"Leena Chandavarkar, Anil Dhawan",Comedy,,1973,,
Hum Sab Chor Hain,,"Dara Singh, Sadhana",Drama,,1973,,
Insaaf,Adurthi Subba Rao,"Waheeda Rehman, Tanuja, Vijay Arora, Pran",Drama,,1973,,
Jaise Ko Taisa,Murugan Kumaran,"Jeetendra, Reena Roy",Drama,,1973,,
Jalte Badan,Ramanand Sagar,"Kiran Kumar, Kumkum, Pradeep Kumar",Drama,,1973,,
Jheel Ke Us Paar,Bhappi Sonie,"Dharmendra, Mumtaz, Pran",Romance,,1973,,
Joshila,Yash Chopra,"Dev Anand, Raakhee, Hema Malini, Pran",Thriller,,1973,,
Jugnu,Pramod Chakravorty,"Dharmendra, Hema Malini, Pran",Drama,,1973,,
Jwar Bhata,Adurthi Subba Rao,"Dharmendra, Saira Banu",Drama,,1973,,
Jyot Jale,Satyen Bose,Nirupa Roy,Drama,,1973,,
Kahani Hum Sab Ki,Rajkumar Kohli,"Lalita Pawar, Mala Sinha",Drama,,1973,,
Kahani Kismat Ki,Arjun Hingorani,"Dharmendra, Rekha",Action,,1973,,
Kashmakash,Feroz Chinoy,"Rekha, Feroz Khan, Shatrughan Sinha",Action,,1973,,
Keemat,Ravikant Nagaich,"Rekha, Dharmendra, Prem Chopra",Action,,1973,,
Khoon Khoon,Mohammed Hussain,"Danny Denzongpa, Rekha",Action,,1973,,
Kachche Dhaage,Raj Khosla,"Vinod Khanna, Kabir Bedi, Moushumi Chatterjee",Action,,1973,,
Kunwara Badan,Vimal Tewari,,Drama,,1973,,
Loafer,A. Bhimsingh,"Dharmendra, Mumtaz",Romance,,1973,,
Maha Sati Savitri,Chandrakant,"Jayshree Gadkar, Upendra Trivedi",Fantasy,,1973,,
Manchali,Raja Nawathe,"Sanjeev Kumar, Leena Chandavarkar",Romance,,1973,,
Mehmaan,Kotayya Pratyagatma,"Rekha, Biswajeet, Leela Chitwas",Crime,,1973,,
Mera Desh Mera Dharam,Dara Singh,"Dara Singh, Raj Kapoor",Drama,,1973,,
Nafrat,Shyam Ralhan,"Rakesh Roshan, Yogeeta Bali",Romance,,1973,,
Nai Duniya Naye Log,B. R. Ishara,"Danny Denzongpa, Reena Roy",Drama,,1973,,
Naina,Kanak Mishra,"Shashi Kapoor, Moushumi Chatterjee",Drama,,1973,,
Namak Haraam,Hrishikesh Mukherjee,"Rajesh Khanna, Amitabh Bachchan, Rekha",Drama,,1973,,
Naya Nasha,Hari Dutt,"Nanda, Madan Puri",Action,,1973,,
Nirdosh,S.M. Sagar,"Vinod Mehra, Yogeeta Bali",Drama,,1973,,
Paanch Dushman,Shyam Ralhan,"Vinod Khanna, Pran",Action,,1973,,
Rickshawala,K. Shankar,"Mala Sinha, Randhir Kapoor, Neetu Singh, Pran",,,1973,,
Saudagar,Shubendu Roy,"Nutan, Amitabh Bachchan, Padma Khanna",Drama,,1973,,
Shareef Budmaash,Raj Khosla,"Dev Anand, Hema Malini",,,1973,,
Yaadon Ki Baaraat,Nasir Hussain,"Dharmendra, Zeenat Aman, Vijay Arora, Tariq Khan, Ajit Khan, Neetu Singh",Drama,,1973,,
Zanjeer,Prakash Mehra,"Amitabh Bachchan, Jaya Badhuri, Pran",Action,,1973,,
27 Down,Awtar Krishna Kaul,"Raakhee Gulzar, Sudhir Dalvi",Drama,,1974,,
36 Ghante,Raj Tilak,"Raaj Kumar, Sunil Dutt, Parveen Babi",Thriller,,1974,,
5 Rifles,I. S. Johar,"Rajesh Khanna, Shashi Kapoor",Action,,1974,,
Aahat,Kishore Kumar,"Dharmendra, Vinod Mehra, Jaya Bachchan, Shreeram Lagoo",,,1974,,
Aap Ki Kasam,J. Om Prakash,"Rajesh Khanna, Mumtaz",Romance,,1974,,
Aashiana,Syed Hussain,Neetu Singh,Drama,,1974,,
Aarop,Atma Ram,"Saira Banu, Vinod Mehra",Romance,,1974,,
Ajanabee,Shakti Samanta,"Rajesh Khanna, Zeenat Aman",Romance,,1974,,
Albeli,Karunesh Thakur,"Vinod Mehra, Rehana Sultan",Romance,,1974,,
Amir Garib,Mohan Kumar,"Dev Anand, Hema Malini, Tanuja",Action,,1974,,
Anjaan Raahen,Mohan Kumar,"Feroz Khan, Asha Parekh",Comedy,,1974,,
Ankur,Shyam Benegal,"Shabana Azmi, Ananth Nag",Drama,,1974,,
Apradhi,Jugal Kishore,Yogeeta Bali,Drama,,1974,,
Archana,Satpal,Sanjeev Kumar,Drama,,1974,,
Avishkaar,Basu Bhattacharya,"Rajesh Khanna, Sharmila Tagore, Dina Pathak",Romance,,1974,,
Azad Mohabbat,Batra Kaushalraj,Yogeeta Bali,Drama,,1974,,
Badhti Ka Naam Dadhi,Kishore Kumar,"Kishore Kumar, Ashok Kumar",Drama,,1974,,
Badi Maa,Ram Narayan Gabale,,,,1974,,
Badla,Vijay,"Moushumi Chatterjee, Mehmood Ali",Drama,,1974,,
Balak Dhruv,Himmat Dave,Abhi Bhattacharya,Drama,,1974,,
Bazaar Band Karo,B.R. Ishara,,,,1974,,
Benaam,Narendra Bedi,"Amitabh Bachchan, Moushumi Chatterjee",Suspense,,1974,,
Bidaai,L.V. Prasad,"Jeetendra, Leena Chandavarkar",Drama,,1974,,
Call Girl,Vijay Kapoor,Vikram,Drama,,1974,,
Charitraheen,Shakti Samanta,"Sanjeev Kumar, Sharmila Tagore, Yogeeta Bali",Drama,,1974,,
Chattan Singh,Kedar Kapoor,"Roopesh Kumar, Vinod Mehra",Drama,,1974,,
Chhote Sarkar,K. Shankar,Shammi Kapoor,Drama,,1974,,
