Opening,Opening.1,Title,Director,Cast,Studio,Year
JAN,1.0,Ghost Stories,Karan JoharDibakar BanerjeeZoya AkhtarAnurag Kashyap,Sobhita DhulipalaMrunal ThakurAvinash TiwaryJanhvi KapoorSurekha SikriRaghuvir YadavGulshan DevaiahVijay VarmaPavail GulatiJyoti SubhashEva Ameet PardeshiKitu GidwaniSumit Tandon,"RSVP Movies, Flying Unicorn Entertainment, Netflix",2020
JAN,3.0,Bhangra Paa Le,Sneha Taurani,Sunny KaushalRukshar DhillonShriya Pilgaonkar,RSVP Movies,2020
JAN,3.0,Sab Kushal Mangal,Karan Vishwanath Kashyap,Akshaye KhannaRiva KishanPriyank Sharma,One Up Entertainment,2020
JAN,3.0,Shimla Mirchi,Ramesh Sippy,Hema MaliniRajkummar RaoRakul Preet Singh,Viacom18 Motion Pictures,2020
JAN,10.0,Chhapaak,Meghna Gulzar,Deepika PadukoneVikrant Massey,"Fox Star Studios, Ka Productions, Mriga Films",2020
JAN,10.0,Tanhaji,Om Raut,Ajay DevgnSaif Ali KhanKajolSharad Kelkar,"Ajay Devgn FFilms, T-Series",2020
JAN,17.0,Bunker,Jugal Raja,Abhijeet SinghArindita Kalita,Wagging Tail Entertainment,2020
JAN,17.0,Jai Mummy Di,Navjot Gulati,Sunny SinghSonnalli SeygallPoonam DhillonSupriya Pathak,"Luv Films, T-Series",2020
JAN,24.0,Panga,Ashwiny Iyer Tiwari,Kangana RanautJassi GillRicha ChadhaNeena Gupta,Fox Star Studios,2020
JAN,24.0,Street Dancer 3D,Remo D'Souza,Varun DhawanShraddha KapoorPrabhu DevaNora FatehiAparshakti KhuranaMurali SharmaRaghav JuyalDharmesh YelandePunit PathakJigar RupareliyaSonam Bajwa,"T-Series, Remo D'Souza Entertainment",2020
JAN,31.0,Gul Makai,H.E. Amjad khan,Reem ShaikhAtul KulkarniDivya DuttaOm PuriArif ZakariaMukesh RishiAbhimanyu SinghPankaj Tripathi,Pen India Limited,2020
JAN,31.0,Happy Hardy and Heer,Raka,Himesh ReshammiyaSonia Mann,"HR Musik Limited, EYKA Films",2020
JAN,31.0,Jawaani Jaaneman,Nitin Kakkar,Saif Ali KhanTabuAlaya Furniturewala,Pooja Entertainment,2020
JAN,31.0,Pagleaazam,"Vikas P Kavvthekaar, Aps Raghuvanshi",Aditya Pratap SinghMandeep Kaur MannnatSonia SharmaLiliputFaruqueRavi MannAbhinaye SharmaSahil PatelAmber Upadhyay,Aps Entertainment,2020
FEB,4.0,Operation Parindey,Sanjay Gadhvi,Amit SadhRahul DevAakash DahiyaRucha Inamdar,"Final Coast, Fluence Studios, Roll Kamera Motion Pictures, ZEE5",2020
FEB,7.0,Hacked,Vikram Bhatt,Hina KhanRohan ShahMohit MalhotraSid Makkar,Zee Studios,2020
FEB,7.0,Kaanchli Life in a Slough,Dedipya Joshii,Sanjay MishraShikha Malhotra,Pisceann Pictures,2020
FEB,7.0,Malang,Mohit Suri,Aditya Roy KapurDisha PataniAnil KapoorElli AvrRamAmruta Khanvilkar,"T-Series, Luv Films",2020
FEB,7.0,Shikara,Vidhu Vinod Chopra,Aadil KhanSadia Khateeb,"Vinod Chopra Films, Fox Star Studios",2020
FEB,14.0,Love Aaj Kal,Imtiaz Ali,Kartik AaryanSara Ali KhanRandeep Hooda,"Jio Studios, Maddock Films, Reliance Entertainment, Window Seat Films",2020
FEB,14.0,Shukranu,Bishnu Dev Halder,DivyennduShweta Basu PrasadSheetal Thakur,"Reliance Entertainment, ZEE5",2020
FEB,21.0,Bhoot – Part One: The Haunted Ship,Bhanu Pratap Singh,Vicky KaushalBhumi Pednekar,Dharma Productions,2020
FEB,21.0,The Hundred Bucks,Dushyant Pratap Singh,Kavita TripathiDinesh BawraJaid Shaikh,Dushyant Corporation,2020
FEB,21.0,Shubh Mangal Zyada Saavdhan,Hitesh Kewalya,Ayushmann KhurranaJitendra KumarGajraj RaoNeena GuptaManurishi ChaddhaSunita RajwarMaanvi GagrooPankhuri AwasthyNeeraj Singh,"Colour Yellow Productions, T-Series",2020
FEB,21.0,Yeh Ballet,Sooni Taraporevala,Julian SandsAchintya BoseManish Chauhan,"Roy Kapur Films, Netflix",2020
FEB,28.0,Doordarshan,Gagan Puri,Mahie GillManu Rishi ChaddhaDolly AhluwaliaSupriya ShuklaRajesh SharmaMehak ManwaniSumit Gulati,"Arya Films, UFO Moviez",2020
FEB,28.0,Guns of Banaras,Sekhar Suri,Karan NathNathalia KaurAbhimanyu SinghGanesh VenkatramanShilpa ShirodkarZarina WahabMohan AgasheTej Sapru,"AJ Media Corp, Dashaka Cinema Co Production",2020
FEB,28.0,Haunted Hills,Sanjeev Kumar Rajput,Zuber K. KhanDiana Khan,"RSBS Films, UFO Moviez",2020
FEB,28.0,O Pushpa I Hate Tears,Dinkar Kapoor,Krushna AbhishekKarthik JayaramArjumman Mughal,"Films@50, Wavelength Studios",2020
FEB,28.0,Thappad,Anubhav Sinha,Taapsee PannuPavail GulatiMaya SaraoNaila Grewal,"Benaras Media Works, T-Series",2020
MAR,2.0,Dheet Patangey,Ravi Adhikari,Shivin NarangChandan Roy SanyalAli MuradHardik SanghaniTillotama ShomePriya Banerjee,"Happi Digital,Hotstar",2020
MAR,6.0,Baaghi 3,Ahmed Khan,Tiger ShroffRiteish DeshmukhShraddha KapoorAnkita Lokhande,"Nadiadwala Grandson Entertainment, Fox Star Studios",2020
MAR,6.0,Guilty,Ruchi Narain,Kiara AdvaniAkansha Ranjan KapoorGurfateh Singh PirzadaTaher ShabbirDalip TahilKunal VijaykarManu RishiJanya JoshiChayan Chopra,"Dharmatic, Netflix",2020
MAR,6.0,Kaamyaab,Hardik Mehta,Sanjay MishraDeepak Dobriyal,"Red Chillies Entertainment, Drishyam Films",2020
MAR,13.0,Angrezi Medium,Homi Adajania,Irrfan KhanKareena KapoorRadhika MadanDeepak DobriyalPankaj Tripathi,Maddock Films,2020
MAR,27.0,Maska,Neeraj Udhwani,Manisha KoiralaNikita DuttaJaved JaffreyPrit KamaniShirley Setia,"Mutant Films, Netflix",2020
APR,10.0,Bamfaad,Ranjan Chandel,Aditya RawalShalini PandeyVijay Varma,"JAR Pictures, ZEE5",2020
APR,21.0,Ateet,Tanuj Bhramar,PriyamaniSanjay SuriRajeev Khandelwal,"Funtime Entertainment, Indian Film Studios, ZEE5",2020
MAY,1.0,Mrs. Serial Killer,Shirish Kunder,Jacqueline FernandezManoj BajpayeeMohit RainaZayn Marie,"Three's Company Productions Pvt.Ltd, Netflix",2020
MAY,20.0,What Are the Odds,Megha Ramaswamy,Yashaswini DayamaKaranvir MalhotraAbhay Deol,"FilmKaravan, Netflix",2020
MAY,22.0,Ghoomketu,Pushpendra Nath Misra,Nawazuddin SiddiquiRagini KhannaRicha ChadhaAnurag KashyapDeepika AminRaghuvir YadavIla ArunSwanand Kirkire,"Phantom Films, Sony Pictures, ZEE5",2020
JUN,1.0,Chippa,Safdar Rehman,Sunny PawarJoyraj BhattacharyaSumeet ThakurGautam SarkarMasood AkhtarKalpan Mitra,"Traveling Light Pictures, Ultra Media & Entertainment, Victory Media, Wishberry Films",2020
JUN,5.0,Chintu Ka Birthday,Devanshu KumarSatyanshu Singh,Vinay PathakTillotama ShomeNate Scholz,"Final Draft, ZEE5",2020
JUN,5.0,Choked,Anurag Kashyap,Saiyami KherRoshan MathewAmruta SubhashRajshri Deshpande,"JAR Pictures, Good Bad Films, Netflix",2020
JUN,12.0,Axone,Nicholas Kharkongor,Dolly AhluwaliaSayani GuptaTenzin DalhaVinay PathakLin LaishramAsenla JamirLanuakum Ao,"Saregama India, Yoodlee films",2020
JUN,12.0,Gulabo Sitabo,Shoojit Sircar,Farrukh JaffarAmitabh BachchanAyushmann KhurranaVijay RaazBrijendra KalaNalneesh Neel,"Rising Sun Films, Kino Works, Prime Video",2020
JUN,18.0,Kadakh,Rajat Kapoor,Kalki KoechlinRanvir ShoreyShruti SethManoj PahwaTara SharmaCyrus SahukarMansi Multani,"Mithya Talkies, Sony LIV",2020
JUN,19.0,Chaman Bahaar,Apurva Dhar Badgaiyann,Jitendra KumarRitika Badiani,"Saregama India, Yoodlee films",2020
JUN,24.0,Bulbbul,Anvita Dutt,Tripti DimriAvinash TiwaryRahul BoseParambrata ChatterjeePaoli Dam,"Clean Slate Films, Netflix",2020
JUN,26.0,Bhonsle,Devashish Makhija,Manoj BajpayeeSantosh JuvekarIpshita Chakraborty SinghAbhishek Banerjee,"Muvizz, Sony LIV",2020
JUN,27.0,Unlock,Debatma Mandal,Kushal TandonHina KhanRishabh SinhaAditi Arya,"Krasnaya Corporation, Wind Horse Films, ZEE5",2020
JUL,16.0,Virgin Bhanupriya,Ajay Lohan,Urvashi RautelaGautam Gulati,"Dhariwal Films, ZEE5",2020
JUL,24.0,Dil Bechara,Mukesh Chhabra,Sushant Singh RajputSanjana SanghiSaif Ali Khan,"Fox Star Studios, Disney+ Hotstar",2020
JUL,30.0,Yaara,Tigmanshu Dhulia,Vidyut JammwalShruti HaasanAmit SadhVijay VarmaKenny Basumatary,"Tigmanshu Dhulia Films, Azure Entertainment, ZEE5",2020
JUL,31.0,Shakuntala Devi,Anu Menon,Vidya BalanJisshu SenguptaSanya MalhotraAmit Sadh,"Abundantia Entertainment, Sony Pictures Networks India, A Genius Films Production, Prime Video",2020
JUL,31.0,Lootcase,Rajesh Krishnan,Kunal KhemuRasika DugalVijay RaazRanvir ShoreyGajraj RaoAryan PrajapatiShashi RanjanSumit Nijhawan,"Fox Star Studios, Soda Films, Disney+ Hotstar",2020
JUL,31.0,Raat Akeli Hai,Honey Trehan,Nawazuddin SiddiquiRadhika ApteShweta TripathiIla ArunShivani RaghuvanshiAditya SrivastavaTigmanshu DhuliaSwanand Kirkire,"RSVP Movies, Netflix",2020
AUG,6.0,Pareeksha,Prakash Jha,Adil HussainPriyanka BoseSanjay Suri,"Prakash Jha Productions, ZEE5",2020
AUG,12.0,Gunjan Saxena: The Kargil Girl,Sharan Sharma,Janhvi KapoorPankaj TripathiAngad BediVineet Kumar SinghManav Vij,"Dharma Productions, Zee Studios, Netflix",2020
AUG,14.0,Khuda Haafiz,Faruk Kabir,Vidyut JammwalShivaleeka OberoiAnnu KapoorShiv PandittAahana Kumra,"Panorama Studios, Disney+ Hotstar",2020
AUG,21.0,Mee Raqsam,Baba Azmi,Naseeruddin ShahDanish HusainAditi SubediShradha KaulRakesh Chaturvedi,"AZMI Pictures, ZEE5",2020
AUG,21.0,Class of '83,Atul Sabharwal,Bobby DeolBhupendra JadawatHitesh BhojrajAnup SoniJoy SenguptaSameer ParanjapeNinad MahajaniPrithvik Pratap,"Red Chillies Entertainment, Netflix",2020
AUG,28.0,Sadak 2,Mahesh Bhatt,Sanjay DuttPooja BhattAlia BhattAditya Roy Kapur,"Vishesh Films, Fox Star Studios, Disney+ Hotstar",2020
AUG,28.0,Ram Singh Charlie,Nitin Kakkar,Kumud MishraDivya DuttaAkarsh KhuranaFarrukh SeyerSalima RazaRohit Rokhade,"Little Too Much Productions, Sony Liv",2020
SEP,5.0,Atkan Chatkan,Shiv Hare,Sachin ChaudharyYash RaneTamanna Dipak,"Lokaa Entertainment, ZEE5",2020
SEP,9.0,Cargo,Arati Kadav,Vikrant MasseyShweta Tripathi,"Fundamental Pictures, Electric Films, Netflix",2020
SEP,11.0,Tiki Taka,Parambrata Chatterjee,Emona EnabuluParambrata ChattopadhyayRitabhari ChakrabortySaswata Chatterjee,"Ratanshree Nirman, Ten Films, Roadshow Films, ZEE5",2020
SEP,18.0,Dolly Kitty Aur Woh Chamakte Sitare,Alankrita Shrivastava,Konkona Sen SharmaBhumi PednekarAmol ParasharAamir BashirKubbra SaitKaran KundraVikrant MasseyMushtaq Khan,"Balaji Motion Pictures, ALT Entertainment, Netflix",2020
SEP,18.0,London Confidential,Kanwal Sethi,Mouni RoyPurab KohliKulraj RandhawaSagar AryaParvesh RanaJas BinagDiljohn SinghKiren Jog,"JAR Pictures, ZEE5",2020
SEP,21.0,Halahal,Randeep Jha,Sachin KhedekarBarun Sobti,"Eros International, Eros Now",2020
21,,,,,,2020
OCT,2.0,Khaali Peeli,Maqbool Khan,Ishaan KhatterAnanya PandayJaideep Ahlawat,"Zee Studios, Offside Entertainment, Zee Plex, ZEE5",2020
OCT,2.0,Serious Men,Sudhir Mishra,Nawazuddin SiddiquiAakshath DasShweta Basu PrasadNassarIndira Tiwari,"Bombay Fables, Cineraas Entertainment, Netflix",2020
OCT,2.0,Bahut Hua Samman,Ashish R Shukla,Raghav JuyalAbhishek ChauhanSanjay MishraRam KapoorNidhi SinghNamit DasFlora Saini,"Yoodlee films, Disney+ Hotstar",2020
OCT,9.0,Ginny Weds Sunny,Puneet Khanna,Yami GautamVikrant Massey,"Soundrya Production, Netflix",2020
OCT,21.0,Comedy Couple,Nachiket Samant,Saqib SaleemShweta Basu Prasad,"Yoodlee films, ZEE5",2020
OCT,29.0,Taish,Bejoy Nambiar,Pulkit SamratKriti KharbandaJim SarbhHarshvardhan RaneAnkur RatheeZoa MoraniSanjeeda SheikhNeha SharmaAditya PancholiAmrita Puri,"Ease My Trip, Getaway Pictures Presentation, A Crayon Films Production, ZEE5",2020
OCT,30.0,Kaali Khuhi,Terrie Samundra,Shabana AzmiSatyadeep MishraRiva AroraSanjeeda Sheikh,Netflix,2020
NOV,9.0,Laxmmi Bomb,Raghava Lawrence,Akshay KumarKiara Advani,"Cape of Good Films, Fox Star Studios, Shabinaa Entertainment, Tushar Entertainment House, Disney+ Hotstar",2020
NOV,12.0,Ludo,Anurag Basu,Abhishek BachchanRajkummar RaoAditya Roy KapurFatima Sana ShaikhSanya MalhotraPankaj TripathiRohit Suresh SarafPearle MaaneyAsha NegiInayat VermaShalini Vats,"T-Series, Anurag Basu Productions, Netflix",2020
NOV,13.0,Chhalaang,Hansal Mehta,Rajkummar RaoNushrat Bharucha,"T-Series, Luv Films, Ajay Devgn FFilms, Amazon Prime Video",2020
NOV,13.0,Suraj Pe Mangal Bhari,Abhishek Sharma,Manoj BajpayeeDiljit DosanjhFatima Sana Shaikh,"Zee Studios, Essel Vision Productions",2020
NOV,,,,,,2020
DEC,11.0,Durgavati,G. Ashok,Bhumi PednekarArshad Warsi,"Abundantia Entertainment, T-Series, Cape of Good Films, Amazon Prime Video",2020
DEC,25.0,Coolie No. 1,David Dhawan,Varun DhawanSara Ali Khan,"Pooja Entertainment, Amazon Prime Video",2020
